Post ID,Comment ID,Text,Score,Author,Created
1h2wng8,lzor1mr,"I had to hand in the Sony as part of the deal - I could have taken it home and posted it later but that's a faff. Shame really, but I do take tons of photos of the same thing from mostly the same angle so I'll try to dig them up, though they'd be at significantly different times, or even seasons. 

Unlike the Xiaomi, i can't find a way of turning off the Hassleblad tuning here. Maybe that's what's keeping the contrast high, but there's a 'natural' filter that negates it.",1,roomyverse,1732955083.0
1h2wng8,lzqhp8g,"> Also Bokeh on Xperia is nothing compared to the real bokeh of the Oppo main sensor.

Care to share with the class how is it so much better, it's the same sensor. ?",1,LTyyyy,1732986110.0
1h2wng8,lzqlccq,"How would I best test that? The video mode has an 'ultra steady' mode which is nuts, but night shots are also pretty good, though it gets a little bit painterly over 20x in low light, as well as making a bit of a pig's ear of text when zooming over 20x in all lights.",1,roomyverse,1732987320.0
1h2wng8,lzunoks,Fair enough.,1,RenegadeUK,1733047456.0
1h2wng8,lzqbu6w,"Pretty much this, also I heard that ColorOS has become very good. From what I know it's pretty much the perfect balance between features and performance.",2,Blunt552,1732984128.0
1h2wng8,lzovxg4,"Things end up about the same in the end, each brand has its strength and weaknesses. Every year they sell us cutting edge hardware and improvements. The thing is to find the device that matches the best with our needs. And from these phones, there's something missing for me.",1,TonMarraine460,1732958432.0
1h2wng8,lzp86zw,"Natural is the most 'DSLR'esk profile to use. The standard profile is similair to vivid in leica, boosted contrasts and saturation.",1,Blunt552,1732966838.0
1h2wng8,lzql4fs,"Lets first point out they're not the same sensor, one is the IMX 888 on Sony and the other is the LYT 808 on Oppo.

As for how it's better:

1.) Oppo has a Lyt-808 at f/1.6, full 50mp sensor.

2.) Sony has cropped IMX 888 sensor (52mp to 48mp), at  f/1.9.

Since you don't know how aperature works, heres a little basic course for you:

[https://www.canon-europe.com/pro/infobank/aperture/](https://www.canon-europe.com/pro/infobank/aperture/)

You're welcome.",0,Blunt552,1732987247.0
1h2wng8,lzqpzkk,"Well it's 20x after all, the xperia would produce similair results at 7.1x. 

As for testing, well it's more or less just a feeling i suppose, with the xperia phones the OIS on telephoto is still very shaky and sometimes it's hard to take a pictures, particularly in portrait mode, I wonder how the Oppo is in terms of OIS on telephoto, I've seen phones like the pixel having an absolute excellent OIS implementation, hence I wonder where Oppo stacks there, as Oppo isn't a device I could get my hands on as they were exlusively chinese up until the 8 series.",2,Blunt552,1732988852.0
1h2wng8,lzqcc4m,"C0pium detected. I'm sorry but aside from speakers the oppo crushes the Xperia in literally every other department, it's more refined, fun, has far better hardware such as camera, battery, charging IC, wireless chargin tech, battery tech, display etc. 

Sony feels like motorola, barebones and midrange hardware, that's it.",0,Blunt552,1732984298.0
1h2wng8,lzquafj,">  Lyt-808

Ah I thought it's the t808, so it's actually the older (and supposedly worse) version, good to know.

If you're explaining the difference as ""the f1.9 bokeh on xperia is nothing compared to the real bokeh of f1.6 on oppo"" then lmao, barely a difference.",2,LTyyyy,1732990219.0
1h2wng8,lzqemlx,"Could you please let me (and a lot of Xperia users here) enjoy my (our) ""midrange hardware"" in peace ? It'll be a lovely gift, think about it Xmas is coming ",5,TonMarraine460,1732985074.0
1h2wng8,lzqesef,"if you stop the gaslight sure but you won't, so deal with people pointing out your lies.",-2,Blunt552,1732985128.0
1h2wng8,lzqfnun,"Gaslight about my tastes ? Well, you're onto something, keep going, you never disappoint...",4,TonMarraine460,1732985424.0
1h2wng8,lzuhy41,"Why do you think people are lying? They enjoyed their Xperia as I enjoyed mine, for all the reasons it's good. On your logic we would all own one phone that outshines all others across the board, but that phone doesn't exist. Yes, I think the Oppo shows where Sony could improve - and should if it wants to gain any traction - but at it's current price point (a shave sub a grand) it's still a valid option if it gives you what you need.",0,roomyverse,1733043571.0
1h2wng8,lzuyja3,"How is that an excuse to lie and gaslight? I enjoy my 1V but im not going around pretending its some dslr replacement, device for audiophiles or great value in any way. 

There is a difference between enjoying a device and gaslighting people into buying something they dont want. 

By my logic you buy what you want and enjoy but be honest about the thing you have to other people. When people ask for an excellent camera phone and people here pretend the xperia is some next gen pro device while the exact opposite is true how the fk is that ok? When audiophiles ask if sony is finally the lg replacement and the sony glazers start gaslighting and lying to the people, how the fk is that ok? 

Some people do not earn a lot of money, for them buying a phone is a big purchase, so people here will gaslight them into  thinking its worth importing a phone they cant return for a hefty pricetag only to realize they have been lied to. Thats apparently ok to you.",1,Blunt552,1733054599.0
1h2wng8,lzv186u,"Because 'lying' and 'gaslighting' are words that assume a malicious intent. Why would anyone genuinely sell strangers a pup? ""Because they feel bad about buying a pup themselves and getting others to join the club makes them feel better“? Who are you to ascribe feelings to anyone, let alone malicious ones. That they haven't dipped their toes in Chinese waters doesn't make them lying bandits, just users who are happy with their Xperia. And a lot of them, like me, have been flagship power users for years and aren't totally stupid, which seems to be the only reason you think anyone would buy Sony. Sometimes choices aren't wide. If you're on contract, your flagship options (in the UK anyway) are pretty sparse outside the boring big three, against which Sony are the feature-packed different option.",2,roomyverse,1733056162.0
1h2wng8,lzv78fo,"Lying isnt malicious, gaslighting is and both are presen on this subreddit. People are trying to manipulate people into buying something they dont want, what the reason gor for that behavior is unknown to me. Whether or not you like it, thats reality and no amount of crying and interpretation from your side is going to change reality you can keep btching but itll solve nothing. 

They have been predented with enough evidence but still font care. People here are well aware that the chinede phones are far superior in photography but because of some mental tick they start to associate their phone with themselves, effectively meaning if you say anything negative about the phone they take it personal. Furthermore all topics where people legit have issues get downvoted and no help is provided, something you apparently support. 

The fact you claim sony is feature packed is hilarious to say the least.",0,Blunt552,1733059241.0
1h2wng8,lzvgpfz,"Micro SD and the Jack are practical features. No notch is a feature, as is the design. These are positives over the big three, no matter how much the jack lags behind an LG or how slow the card reader is. The design means compromises, as we've said before, but we also said before that if it'd been 200 quid cheaper at launch we probably wouldn't be arguing, and now it's 300 quid cheaper. I get what you say about people identifying with their purchase, though, but then isn't that what people do? Isn't  that why there are tech tribes - people focussing on the positives, on what they want, and sidelining the negatives. The big three have plenty of both too. Visitors to subs have to sort the wheat from the chaff. It's all part of any pre-purchase research, and anyone who relies solely on a sub gets what they deserve. But to suggest the Sony has no merit is to do it a disservice, and to suggest anyone who buys it is a fool and/or a liar is just unnecessarily antagonistic.",2,roomyverse,1733063289.0
1h2wng8,lzvnxmj,"Sure, features that most people dont use. No notch is not a feature its a design choice. 

And thats all you got? Really? Feature rich? So mid range motorola is feature rich now because it has sd card, headphone jack and no notch? Thats dumb af. 

Also what is the big three? Sure samsung and iphone but what about the third? Xiaomi? 

Also to suggest that gaslighting is ok because ""they could do better research"" is a ridiculous mindset. Also you keep ignoring my points and keep trying to force your own interpretation inyo reality except that doesnt work. 

Youre the one claiming Sony has no merit not me. Im merely stating that almost all people are way better off with phones like the oneplus 13. You keep yapping some nonsense that has never been stated because of your feelings.",1,Blunt552,1733066035.0
1igu6ek,marmm6r,both the zoom and battery life are the device's greatest strengths so don't worry about that,7,TheNass22,1738603114.0
1igu6ek,marn7no,Vivo x200 pro is better,6,Similar_Teacher8976,1738603279.0
1igu6ek,marw58t,"I absolutely love mine! Just a tip: make sure to turn off the longer shutter speed, as it sometimes switches on automatically in darker environments. I took some amazing photos during a concert, and all my friends were really impressed.",5,thsbrgvt,1738605749.0
1igu6ek,marny0d,The very next post [https://www.reddit.com/r/Oppo/comments/1igqpn7/using\_find\_x8\_in\_concerts/](https://www.reddit.com/r/Oppo/comments/1igqpn7/using_find_x8_in_concerts/) also [https://www.reddit.com/r/Oppo/comments/1i9ovzg/concert\_photography\_with\_the\_find\_x8\_pro/](https://www.reddit.com/r/Oppo/comments/1i9ovzg/concert_photography_with_the_find_x8_pro/),4,cliffr39,1738603483.0
1igu6ek,mavlkq8,"Vivo is better  due to the sensor being larger

In fact id rather get oppo find x7 pro/ultra over x8p if i wanted superb long shots 

However vivo os isnt my favourite.",3,lolicekait,1738647454.0
1igu6ek,mb0odmg,It's also subjective but ColorOS is a lot more polished than FunTouch OS. Secondly the Vivo takes better still shots in some scenarios however the Oppo is slightly better than the Vivo when it comes to video especially since it has a dedicated concert mode.,2,mister_stoosh,1738714468.0
1igu6ek,mavmdz5,"off topic but ,really you are going to concerts to record videos??? pffff....",-1,Thor_necro,1738647834.0
1igu6ek,marn1jo,"Thank you so much, might get one soon. Couldn’t entrust my future concert photos and videos to Samsung anymore.. my iPhone 8+ worked a hundred times better during the concert!! 😩",3,Min_Niki,1738603233.0
1igu6ek,matz4ev,"the dedicated concert mode on Oppo may beat Vivo.


also it's not a clear cut win for Vivo, although Vivo has a slight edge, there are some scenarios where Oppo wins.


I woke say in video zoom in and out Oppo is ahead, it's very smooth and colour grading is very balanced across all lenses.


 For macro, Vivo wins hands down.",4,opayuonam,1738626940.0
1igu6ek,marndm2,Hmm really? I’ve never tried using Vivo - is it around the same price range of the Find X8 Pro? And will it be available globally?,3,Min_Niki,1738603326.0
1igu6ek,marxk3x,Thanks for the tip! I will read more on its specs.. I wanted to get reactions from users first before really considering it as a replacement for my trashy S21 Ultra 😅,3,Min_Niki,1738606146.0
1igu6ek,maw1hom,i wish we can turn off the automatic night mode by default. or do i miss the setting for it?,1,thesakid,1738655993.0
1igu6ek,mb3om4f,How to turn that off,1,ptmtb,1738762249.0
1igu6ek,marp077,Thanks for this!! The photos are so nice!!,2,Min_Niki,1738603776.0
1igu6ek,masv68f,These pics are amazing😍,2,ChicagoBulls101692,1738615460.0
1igu6ek,maw2877,Will check on this. Thank you!,1,Min_Niki,1738656431.0
1igu6ek,mb1eux0,That's what I'm looking for -  concert mode. Leaning towards getting Oppo! Hopefully it's worth the switch 😁,1,Min_Niki,1738723084.0
1igu6ek,maw1zhq,"Why not? I paid for my ticket. And I don't record the whole thing, so why do you ask? And what's with the ""pfffff""?",1,Min_Niki,1738656289.0
1igu6ek,maygiae,Thanks for the input :),1,Min_Niki,1738690897.0
1igu6ek,marog5v,"Yes. It is available in global version. Camera is better than Oppo. Same cpu,battery life ..UI is a little bit better Oppo",1,Similar_Teacher8976,1738603622.0
1igu6ek,marol1e,"Great! Thanks, I will check this out ☺️☺️☺️",4,Min_Niki,1738603659.0
1h3m45h,lzrsznw,"I do not have it BUT...I know it will work on T-Mobile or one of the MVNO's that use their towers. The issue IS twofold for me... NO warranty... and, if you travel to the middle of nowhere, or live in the middle of nowhere you may not have a cell signal worth two dead flies! You need **N71** \- Might be different with another carrier.",1,Ok-Reveal220,1733001480.0
1h3m45h,lzryjt0,"I have oppo x6 pro in NYC , had no network issues. Traveled in pa, all of NY, Canada,and Chicago are no problems",1,angrygarbageman,1733003384.0
1h3m45h,lzryoa4,Had since just after launch,1,angrygarbageman,1733003426.0
1h3m45h,m1gaia4,"I just got mine today and on att you can't dial out. Internet and messages work but not calls. I had a similar issue in the Sony Xperia 1 vi but getting into the phone info page on the dialer with the *#*#4636#*#* and then toggling the dsds on and off did the trick, yet on oppo I can't seem to figure out a way to get into this setting as this does not work. 
On T-Mobile though 5g works full blast and volte also ",1,TareqYounis86,1733878741.0
1h3m45h,lzrusgu,"I'm currently on AT&T and have heard of them blocking certain phones not sure if oppo is on the list, from what it seems I may need to switch carriers.",2,dingalingspring,1733002095.0
1h3m45h,lzs0x2i,What carrier?,1,dingalingspring,1733004199.0
1h3m45h,m0hh8yx,"Hey I'm thinking about getting me a Find X8 Pro - I live here in the States, how can I get one that works (16GB RAM 512GB SSD) and what price range should I expect to get it? Thanks for the help.",1,kingsleyfits,1733370082.0
1h3m45h,m0otisj,"What carrier? Do u have any network issues? Seller told me that there will be network issues, so they won't ship it.",1,Able-Plate9341,1733481864.0
1h3m45h,m1gpxcb,"Thanks for the info mate, seems like the only option is T-Mobile here in the states lmao. Kinda sucks that Att is such ass when it comes to no ""American"" phones.",1,dingalingspring,1733884533.0
1h3m45h,m2tyfxk,Do you have the Global or Chinese?  I have the ability to buy one today but it is the Chinese version... I use Mint mobile but have no issue transferring my # to T-Mobile prepaid if need be...,1,Coltsblue1888,1734620901.0
1h3m45h,m0hhs8v,"Hey I'm thinking about getting me a Find X8 Pro - I live here in the States, how can I get one that works (16GB RAM 512GB SSD) and what price range should I expect to get it? Thanks for the help.",1,kingsleyfits,1733370298.0
1h3m45h,m4y7gzv,It's blocked on att ,1,Tupirujp,1735785623.0
1h3m45h,lzs5nms,"T-Mobile, I just looked at the x8pro the the global version works  on 9 of 15 5g bands in usa and 11 of 13 4g bands and chinese version is 5of 15 5g  and 6 of 13 4g band",1,angrygarbageman,1733005882.0
1h3m45h,m0iqvek,https://wondamobile.com/products/oppo-find-x8-pro-5g-global-version-dual-sim,1,angrygarbageman,1733395675.0
1h3m45h,m0otrc4,What seller?,1,angrygarbageman,1733482017.0
1h3m45h,m0ots55,I have tmobile,1,angrygarbageman,1733482031.0
1h3m45h,m1gy3zb,"You're welcome,Yeah I don't understand why they wont allow them to work, im just gonna run with Google fi for now even though service sucks indoors. The phone is amazing though ",2,TareqYounis86,1733887724.0
1h3m45h,m30gwdw,"global is what i have, mint-tmobile and other tmobile mvnos are fine and will work, no att or verizon as of now though",1,TareqYounis86,1734716934.0
1h3m45h,m0jbbcr,"Mi4Canada might have it soon, averagetechdadofficial has them but I’ve never purchased from them. Wondamobile but I’ve heard they take a long time to ship. Giztop has the Chinese version only.",1,dingalingspring,1733405903.0
1h3m45h,lzs9an9,"Yeah, by also silly question. Is the x8 pro the same as the x7 ultra as last year? or are they going to release an  X8 ultra later next year?",1,dingalingspring,1733007204.0
1h3m45h,m0ir470,I never order from there personally so check out some more reviews.,1,angrygarbageman,1733395829.0
1h3m45h,m0qgt8o,From Aliexpress. Maybe the reason is that it is Chinese version. Probably I should get global version instead of Chinese version. Do you have the global version one?,2,Able-Plate9341,1733505345.0
1h3m45h,m0qhwfl,Do you buy it from wondamobile or have any recommended sellers?,1,Able-Plate9341,1733505681.0
1h3m45h,m4va7ds,What about Google Fi?,1,Aliiza,1735750206.0
1h3m45h,m0pojdd,"Thanks bro, I've been researching, it all seems like too much trouble for someone in the States, I'm leaning more towards the OnePlus 13 when it drops early next year.",1,kingsleyfits,1733496227.0
1h3m45h,lzsac84,What do u mean the same ?,1,angrygarbageman,1733007585.0
1h3m45h,m0polpk,Thanks bro!,1,kingsleyfits,1733496250.0
1h3m45h,m7184l4,It works on fi,1,TareqYounis86,1736822296.0
1h3m45h,m0rr4kb,"I feel that, I’m going to wait for it to be available on Mi4 and purchase it, I like the camera in the middle more then off to the side",1,dingalingspring,1733520085.0
1h3m45h,lzsf1h0,Like they renamed it from ultra to pro but theyre the same device,1,dingalingspring,1733009325.0
1h3m45h,lzsnv99,"No they're not, the pro is a middle step between the base and Ultra. The x8 Pro has an overall worse camera than the x7 ultra and next year there will be an x8 ultra which will be the successor to the x7 ultra.",2,Papa_Bear55,1733012524.0
1h3m45h,lzsqfz1,No different,1,angrygarbageman,1733013467.0
1h3m45h,lzsqppw,"The x8 pro already has a kickass camera compared to most flagships now, I don’t think I need the 1 inch sensor haha.",1,dingalingspring,1733013566.0
1h3m45h,lzsrix2,It's very good that's for sure but I don't think it's particularly impressive and is on par with most other phones. The Ultra version will really set it apart from.,1,Papa_Bear55,1733013865.0
1i9pgpz,m93utko,"Can’t comment on Samsung or Xiaomi. I have both the x8 pro and OP13. Very similar phones tbh. Camera better on x8 pro. Really like both UIs.

Where are you based and how’s the prices for the 4 phones you are considering? Is that a factor?",5,Material-Ranger1990,1737820717.0
1i9pgpz,m94cvr0,"Normally I would have said Oneplus 13 but Color OS is fluid and amazing! If you can afford, go for X8 Pro. Otherwise OP13.",2,Wild-Internet-6168,1737825919.0
1i9pgpz,m94sg4u,I used to own an iphone 14 pro and find X8 pro blows it out of the water in every aspect. As for versus OP 13 the phones are pretty close but the Oppo has better camera performance and longer software support.,2,lukeroux1,1737830371.0
1i9pgpz,m97uzbb,"Price should be the deciding factor here. The X8 Pro simply has better hardware in every regard. And the software is so similar between the two. If you can afford, oppo. If not, OnePlus.",1,shukaku2007,1737867052.0
1i9pgpz,m98e5y4,"I got both and kept the Oppo.


I loved the form factor, screen, button positioning and overall feeling with the OP13, but I value photography too much and RAWs are better on Oppo, as well as video, plus I have an additional camera.



Furthermore, one year more of sw updates made me think that Oppo will focus on ColorOS development and port those to OxygenOS. This is just my feeling tho.",1,Naive_Banana4447,1737876800.0
1i9pgpz,m98rbx0,What do you all think are the biggest software difference between the 2?,1,Demarco313,1737884770.0
1i9pgpz,m9m9pqm,"In a similar dilema but with the OP13 and Find X8 (non pro!). The prices are almost the same, but enable to understand which one is better. I have a priority of camera and battery.",1,Hot_Meaning_2150,1738062684.0
1i9pgpz,m93y2di,"Would you say that OP13 is better in any particular way, like scrolling speed and fluidity? 
What abt audio and brightness under direct sunlight?
Thanks 🙏",1,alexgo72,1737821666.0
1i9pgpz,m9408wy,It’s for daily use I’m not a person that shoot allot of photo’s. Need speed and the phone has to be fluid 😄,1,DannyDerksen,1737822302.0
1i9pgpz,m94ep3z,"They're nearly the same OS, apart some differences",1,Shadow_Of_All,1737826445.0
1i9pgpz,m94u8h9,Oppo it is,2,DannyDerksen,1737830884.0
1i9pgpz,m9d1ma5,How many years updates on the oppo?,1,SeasonAggressive867,1737936179.0
1i9pgpz,m9mmnwh,What charging speeds to do you get on your OPPO? Mine does not go over 27W with the official SuperVOOC 80W charger?,1,Mighty_Buddha,1738068912.0
1i9pgpz,m94gyl8,"I saw someone did a head to head specs comparison in another thread. The OP13 does have a ""slightly"" better-looking screen on paper and in person. But to me, the differences are really minor. Both phones are great under bright sun and daylight. Same parent company :)


No lags for me on either phones. ColorOS and OxygenOS both great and alot of similarities.



I do enjoy the x8 pro camera just slightly more than OP13. I am not an expert photographer, but it does look better on my phone and even when I share it with someone else on iOS. For someone else, it may not be worth the extra 250-300 USD",2,Material-Ranger1990,1737827088.0
1i9pgpz,m94g323,"Then I think the x8 pro and OP13 are very comparable, with the x8 pro slightly ahead for camera.


I know some people may analyze the chip (Snapdragon vs dimensity), screen (2k v 1.5k), etc, all good to look at if that matters to be. But for a regular day to day use, I kept both, one for work, one for personal. Both are excellent phones!",2,Material-Ranger1990,1737826839.0
1i9pgpz,m98zzuj,What differences?,1,opapoutsisgamaei,1737890020.0
1i9pgpz,m9ec85g,"5 years sw updates, 6 of security patches",2,Naive_Banana4447,1737950736.0
1i9pgpz,m94hijf,Thanks 👍,1,alexgo72,1737827249.0
1i9pgpz,m95y54j,"Hey, 
can you tell me if the cameras on OP13/Find X8 Pro are integrated into Snapchat/ Instagram/... so that you can switch between the different cameras?
Samsung and Google have it and I haven't found any information about that for OnePlus/Oppo 

Thanks :)",1,Fearless-Calendar472,1737842889.0
1i9pgpz,m994knd,"I can't remember off the top of my head rn, but ik Realme, Oppo and OnePlus all use the same sorta OS with their own little differences. Like Realme has GT mode for games and the OnePlus calculator app has an easter egg. I think the widget drawer (I think that's what it's called) is also exclusive to OnePlus and the special split screen mode where you can minimise one app to the point it's just a bar.

It's just the same OS, but all 3 companies have their own differences still here and there. I think Realme actually removes some features that Oppo and OnePlus have, weirdly enough.",1,Shadow_Of_All,1737892656.0
1i9pgpz,m9fddeo,Thank you,2,SeasonAggressive867,1737970337.0
1i9pgpz,m963pag,"I'm may not the best source for this. 


I looked, and the controls look different on Instagram compared to the native camera app. On Instagram, I can do wide angle and zoom by pinching, but it does not have the functions or options you'd see in the camera app. Or the ability to use master mode and high res.",1,Material-Ranger1990,1737844670.0
1h11tbz,lz87oai,"If you didn't like the 100 pro much you won't like the 200 pro.
Cameras are mostly the same but 200 pro has better performance and battery compared to 100 pro.",9,andygorhk,1732707380.0
1h11tbz,lz8c3x3,"Depends on what you need. Vivo is a bit better at photo quality at almost all levels. Not that Oppo is bad, it's exceptional, but comparing the 2, vivo wins. If that doesn't matter, get the cheapest you find, they are identical with minor differences.",8,Varadorm,1732709745.0
1h11tbz,lzde329,"Dude Vivo x200 pro has received 3 updates so far for the camera, OPPO is about to get a camera fix update.
Plus Oppo's camera is just 19 if vivo is 20
Not much difference.
I am tired with funtouch OS..
So if u want complete allrounder go for Oppo x8 pro.
Even color os 15 and oppo has optimised 9400 much better than vivo.
Don't think much..
By design, by features, by AI, by Performance, by screen quality, By OS OPPO beats Vivo...
Really love to parallel processing of Color OS 
It beats One UI and iOS as well (done so much research in depth before ordering it)
So go for Find X8 pro as I have already pre ordered",6,TheXclone,1732776380.0
1h11tbz,lz8bety,"It all depends on your use case scenario really. If you're a more photography/videography-centric type of person, then clearly Vivo is the way to go hands down. Now that doesn't mean the Oppo Find X8 Pro is trash by any means but the results from various tests online speak for themselves. As a previous FunTouchOS user (now OriginOS), the former isn't spectacular features wise, but it's still alright and it does a good enough job. But I believe the global variant comes with new AI features & even integrates Google's Circle To Search, so that's quite a nice upgrade to the OS. Perhaps ColorOS is a little more mature and is more confident with what it is and to be fair, Oppo's really good overall so you can't go wrong with either. Just choose based off what you want to use your phone for most of the time.",3,theantimonitorx,1732709390.0
1h11tbz,lz9i01k,I really like the x200 pro but very little 5g coverage.,3,According_Pilot_746,1732725132.0
1h11tbz,lz9i5pq,The global version of the vivo x200 pro is available on ebay. Both are expensive.,3,According_Pilot_746,1732725181.0
1h11tbz,lz8a0dg,Go for vivo without doubt 👌,2,Middle-Chart-467,1732708664.0
