Post ID,Comment ID,Text,Score,Author,Created
1gy7xqa,m0cpzuw,Can you tell me if you could chose German Language on it?,1,Chacky1,1733311710.0
1gy7xqa,lyv5oye,Lithuania,1,mrscript_lt,1732513386.0
1gy7xqa,lzwxu0k,Will this series come to Serbia?? Please say YES 🤣😭,1,National_Depth6735,1733080593.0
1gy7xqa,lyv5odq,"Thanks! Unfortunately not very wide shipping scope.

https://preview.redd.it/juuq6o2mjz2e1.png?width=604&format=png&auto=webp&s=2fe625731804780a8d725d8cd888fc23d4394d18",1,mrscript_lt,1732513378.0
1gy7xqa,m1cjaer,I've ordered from Spain using shipping forwarding service.,2,mrscript_lt,1733832846.0
1gy7xqa,lypsw2o,"Sometimes it's hard to be patient but it's just 1.5 weeks away now! In Portugal it's also on the 3rd of December I think, not sure if it's for pre-order or direct buy",3,Art__Vandelayy,1732440013.0
1gy7xqa,lyqdtvu,"Thank you, I'll try! I'm undecided on whether to keep it or return it, but I think I finally will keep it. My main concern is price: I paid a lot, so I have the feeling it should be ""perfect"", also knowing that ""objectively"" better phones are coming out later on the year, but on the other hand... this one""feels"" right, feels very nice. Maybe I shouldn't obsess on details in a specs sheet over the overwhelmingly positive impression this phone is giving me. 
Anyway, my first Oppo, coming from and iphone before that), and I'm loving it. I'll miss certain stuff from Samsung, but I gained some other things. Let me know if you have any questions, in case I can make your wait easier :)
Cheers and be patient! It's worth it",2,CaraMuuu,1732452495.0
1gy7xqa,m0cr03u,"I no longer have the phone, I ended up returning it (for unimportant reasons, the phone itself is amazing) but I'm pretty sure German was there. But I bought the global version from official EMEA distribution. If you're planning on buying either the Chinese version, or the global version for other region, it might be different (I doubt it though)",1,CaraMuuu,1733312284.0
1gy7xqa,lyyy69u,You might want to check Amazon. I'm not aware of any operations in Lithuania at the moment to be honest.,1,MrKnepp,1732569697.0
1gy7xqa,m0sap35,I don't think there's a official reseller there yet.,1,MrKnepp,1733526842.0
1gy7xqa,lypt4d1,You absolutely right about being a bit more patient. And I hope it’s direct buy from the 3rd 🤞.,2,Kessiah,1732440157.0
1gy7xqa,m0p0xsd,Was there a charger in the box? Thanks in advance ,1,ResolutionFormer7723,1733486249.0
1gy7xqa,m0sbq7l,Yes I know there is not yet... But will it come ? 🫴,1,National_Depth6735,1733527218.0
1gy7xqa,m0p1pyv,No charger and no case.,1,CaraMuuu,1733486667.0
1gy7xqa,m19tzvz,No idea,1,MrKnepp,1733785887.0
1gy0jkr,lyl1yit,"TLDR:    
Zoom cameras: Oppo generally. Esp. sharper at 6x. Vivo better at 10X    
Portraits: Vivo, better stiching (but has skin smoothing)   
Selifies: OP13   
Ultra-wide: Vivo   
Video: Vivo and Oppo   
Video stability: Vivo   
Audio: OP13 clearest, but more susceptible to wind noice",25,Antonis_32,1732373446.0
1gy0jkr,lyojn03,get rid of oneplus and bring Oppo and vivo to the states,15,Ok_Fish285,1732416953.0
1gy0jkr,lyqn8z7,Mountain in the bg is ghosting like mofo due to frame stacking.,4,super_hot_juice,1732456641.0
1gy0jkr,lytlpgh,"Oppo has the best sound recording by a large step, but the Vivo has best photography which I care more about. Can't wait to see the global version for sale.",1,No-Trifle-3247,1732491118.0
1gy0jkr,lzkpcl1,Which is best for macro shots?,1,ptimmaq2,1732896321.0
1gy0jkr,m1rde4v,"wasted my money. There are no manual controls at all, such as shutter speed, white balance, resolution, and FPS, makes it impossible to achieve the desired video quality.I'm disappointed to find that it doesn't even offer the same level of control as my 4-year-old Xiaomi phone.",1,Wonderful_Ad5732,1734039932.0
1gy0jkr,m6wh9gc,What about at x15? Doesn't the OnePlus 13 have a dedicated X15 camera?,1,CompetitiveBrain9316,1736765474.0
1gy0jkr,m6xxfxp,I swear the vivo x200 pro is literally crushing it in every aspect it's a must try I have the OnePlus 12 but I really want to give the vivo a trial run,1,HitmanAladdin27,1736786075.0
1gy0jkr,lylcr77,"zoom cameras oppo? it's clearly vivo, i mean at least IMO.",14,Banished_To_Insanity,1732377239.0
1gy0jkr,lyppazg,This,7,Hzzif,1732437742.0
1gy0jkr,lyqh0lj,"I think there's an issue with this, cause Oppo Vivo I noticed, even in other countries including south east asia countries, they tend to only bring in the entry model rather than pro series. Even X7 wasnt released in some countries.

While Oneplus nowadays usually one device, no longer have pro version - so usually hardware wise, even if global release - usually Oneplus will win.

Software wise is what I think Oppo and Vivo camera excel in.",4,MVP_Troll,1732453994.0
1gy0jkr,m2k1kxi,which phone mate ?,1,Away_Butterscotch343,1734470241.0
1gy0jkr,m2n42et,Which one did you buy?,1,Beriatan,1734519925.0
1gy0jkr,m3f16dk,There are apps where you can adjust that. Obviously not ideal but better than no manual controls at all.,1,BazookaBob23,1734948169.0
1gy0jkr,m64bpkw,We would still like to know which phone you speak of,1,the_tflex_starnugget,1736372402.0
1gy0jkr,lyo3xph,"Oppo has a secondary 6x zoom lens, hence sharper at 6x   

But it's fascinating that vivo is better at 10x since it's digitally zooming from 3x>10x and winning inspite of Oppo only having to do 6x>10x",10,noobqns,1732410853.0
1gy0jkr,lymlb2d,Vivo kills it. Night mode too,5,SpacevsGravity,1732391583.0
1gy0jkr,lz3bxwj,"Not the case in Malaysia, being one of the Southeast Asian countries.


Oppo Find X8 Pro
https://www.oppo.com/my/smartphones/series-find-x/find-x8-pro/


Vivo X200 Pro
https://www.vivo.com/my/products/x200-pro",1,FewManyMore,1732637137.0
1gy0jkr,lyqlyun,i mean not only that but portrait shots with telephoto from vivo also looks better imo,5,Banished_To_Insanity,1732456118.0
1gy0jkr,lz8fxiu,"Watching other reviews, I see vivo uses pixel binning up to 7.4x. 

At 7.4x the sharpness improves (over say 6x)",1,Puzzleheaded-Drama-8,1732711574.0
1gy0jkr,lz7xbu6,"I know not all countries, for example singapore, have oppo find x8 pro, x8 but not x7 or earlier series. Vivo don't have as well, Indonesia Vietnam - they usually only bring in certain flagship.

So what I refering to is, even to friendly countries with trade relations with china (china brand), they only bring certain models over and let alone a competing (US)",1,MVP_Troll,1732700869.0
1hvsynn,m5wng8w,"I own the X8 Pro and purchased the X200 Pro for my wife. We live in India.  I recommend the X200 Pro for its exceptional camera, which excels in both photography and videography.  While the X8 Pro has good software, I am dissatisfied with its camera's performance, particularly in low light where it performs below average. Live photos are average at best, and I have occasionally captured blurry images. On a positive note, the battery life surpasses my previous S24 Ultra.  I am anticipating software updates to address the camera issues, as the Chinese version of the X8 Pro has received numerous performance updates.",2,Professional-Fold670,1736272442.0
1hvsynn,m6n0361,Will these phones work on metro pcs ??,1,bigdawwg707,1736630503.0
1hvsynn,m5y437c,"At 9:00 when she stands close to the tree you moved the oppo to the left side.  Why?  Then again at the end when you did the selfie, you switched sides.  Why?  Why didn't fix this in editing?  I don't know if your video is trust worthy.",0,SkullFoot,1736287627.0
1hvsynn,m5xxy5p,"I had the S24U and I find the camera of the X8 Pro better than the S24U, specially in low light. What do you mean by ""below average""? I think there are maybe just very specific phones that can surpass the Oppo Find X8 Pro and and those, being the ultras from Xiaomi, Vivo, Oppo and the Vivo X200 Pro.",2,IWantAGoodBattery,1736285840.0
1hvsynn,m5y4yw6,Yes in fact x200 pro and findx8 pro both have really good cameras. It's very tough to choose one between them for me. I will be reviewing the new oneplus 13 and s25 ultra soon do subscribe my channel 😄,1,No_Medium_2474,1736287893.0
1hvsynn,m80bcd7,"Has she had any issues with the lens flair? It kind of worries me, I don't want great photos to be ruined by the presence of aggressive lens flair",1,Frikken123,1737306207.0
1hvsynn,m6n06y6,Yeah I mean why not.. do sub the channel and check out the video 😄,1,No_Medium_2474,1736630538.0
1hvsynn,m6xx4qk,As long as it's a GSM network so basically T-Mobile At&t,1,HitmanAladdin27,1736785981.0
1hvsynn,m5y4kan,I moved the oppo to the left and I switched sides? I really didn't get your point here. & why would I lie in my videos . No one is paying me 😭 I am just a photographer who loves to share knowledge bro. & Btw don't get me wrong i really like the design of findx8 pro and it takes better portraits than x200 pro currently. Peace.,3,No_Medium_2474,1736287771.0
1hvsynn,m5y5cfb,I have used Xiaomi 14 ultra for few months and let me tell you Xiaomi 14 ultra has really good hardware but lacks good processing . Xiaomi really needs to focus on its camera processing. Its camera is the most inconsistent due to average camera processing . Do check out my channel for Xiaomi comparisons 🙌,1,No_Medium_2474,1736288006.0
1hvsynn,m5zvdey,"I have been using three of the cameras you mentioned. The X200 Pro camera is the best in my opinion. With the X8 Pro, I was pleased with the daytime images, but the bokeh effect was inconsistent. This was noticeable in the photos I took of my baby, which I have shared with Oppo support to address. Additionally, the Wi-Fi on the X8 Pro is slower compared to the X200 Pro, an issue I have confirmed through multiple tests.

The nighttime images on the X8 Pro are problematic, appearing noisy and exhibiting a pink tint. I have also reported this issue to Oppo support.  In contrast, the S24 Ultra cameras did not meet my expectations, prompting me to sell mine and purchase the X8 Pro through an exchange and additional payment.

https://preview.redd.it/c21plufu1pbe1.jpeg?width=3106&format=pjpg&auto=webp&s=9a667a102150e1a91ea1c28aa4190cf3a7f24e48",1,Professional-Fold670,1736308913.0
1hvsynn,m6n0d19,I haven't heard anyone talk about it . I wanna buy the x200 pro but afraid it won't work . I want to know for sure before I grab it,1,bigdawwg707,1736630591.0
1hvsynn,m5yc2dr,At the bottom of the video where you list which camera took the picture.  Why is that not consistent throughout the video?,0,SkullFoot,1736290060.0
1hvsynn,m60ql6u,"Thanks for the detailed information! I also sold my S24U and Pixel 9 Pro to buy the X8 Pro and I think the X8 Pro performs better than both of them, and I think you agree with me. That's what I meant when asking for the ""below average"". If the X8 Pro is better than the majority of the flagships, it doesn't perform below average, but I do agree with you that the X200 pro is better.",2,IWantAGoodBattery,1736324894.0
1hvsynn,m5ydovd,Oh are u talking about watermark? that's because both phones take pictures at different resolution and different focal length so that's why it's not consistent throughout the video. The dimensions of the pictures varies. Do sub if you like the video 😄🙌,3,No_Medium_2474,1736290564.0
1hvsynn,m60ykqj,"It's not the watermark, he means the pictures themselves - and he is right.   
  
The X200 Pro was on the left half of the video frame throughout - except for the section from 9.05 to 10.36. Again a left-right switch at 17.12  
  
It was unnecessary and a bit confusing.",2,seethahere,1736330067.0
1hvsynn,m64xp20,I am not subscribing because you down voted me.,1,SkullFoot,1736379198.0
1hvsynn,m64yode,Really does that bother you ? that's totally fine as long as u can see the watermarks you can tell which phone took the shot . That's something software does automatically not me man 😃. I hope u focus on the videos and the knowledge i share with you not the pictures switching sides . 😭,1,No_Medium_2474,1736379530.0
1hvsynn,m64y2iz,Nope I didn't downvote you and that's totally fine I am not here to fight for something that I havent done intentionally. I am investing my money and efforts to provide something to my audience and I am very happy with the subscribers i have thanks. Wish u good luck .,1,No_Medium_2474,1736379325.0
1if0pv4,mac8rp6,"It uses the MediaTek Dimensity 9400 which is an excellent chipset, only marginally slower than the new Snapdragon 8 Elite and maybe a little less efficient.

But there are a few compatibility issues with certain games. Like the new Grid Legends doesn't work at all.",4,-CL4MP-,1738393263.0
1if0pv4,macct33,Am using it.  Great phone. No lag and no performance issue,5,BonJonKhan,1738395511.0
1if0pv4,macbyzc,"I upgraded from the Find X5 Pro to the Find X8 Pro and I've not had a single issue, it's a great phone",3,Rattieboy1982,1738395035.0
1if0pv4,madkfhf,"The 9400 is a beast.
It even runs cooler than the SN Elite.

Atleast in my personal use. Ive had the X8 Pro (now the Vivo X200 pro) both 9400 chips and they stay cooler than my Realme GT7 Pro and Oneplus 13",3,SpaceToy,1738418647.0
1if0pv4,madqmj3,"It's not true at all. Mediatek 9400 is a little bit slower than Snap 8 Elite, but it's much more stable and does not heat up (Snap does) - so there is no battery drain at heavy CPU load. As for me - Mediatek is better than Snap at this moment.",3,pexxxxu,1738420865.0
1if0pv4,maec9si,"i have it since a few weeks and it's a great, fluid, fast phone, always cold, I really like it",2,runciter0,1738427783.0
1if0pv4,madfntb,"The only time you will see a difference is in benchmark apps (or supposedly Grid Legends not running I don't game on phones, so no first hand experience). Otherwise day-to-day they are pretty equal in performance. I do find the X8 Pro gets slower cellular data speeds than my Snapdragon phones using the same bands with same RSS signal (WiFi they equal). It doesn't impact data usage, just noticeable again with benchmarking apps like Speed Test",1,cliffr39,1738416811.0
1if0pv4,macipny,"There is one hugeeee difference.

No winlator unless youre playing ancient games.

Also for some reason im having network issues every now and then  ( very rare though)... E.g my whatsapp will act as if i have no wifi but it works with my yt

In some  cases my data speed is like 1 kbps unless i move around as if im playing pokemon go (in specific place that doesnt make sense)",1,lolicekait,1738398928.0
1if0pv4,macp55z,i second this.,2,Gigameister,1738402765.0
1if0pv4,majuir5,"Which did you like better, the X8 Pro or the X200 Pro? I'm stuck right now as to which one to get, but I can't get the global because they only hold 512gb, I need 1Tb.",1,FlabDaddy7654,1738503543.0
1if0pv4,maxbnks,"yup, in order to maintain heating issues on SD Elite, phone company need to put larger cooling , but in mediatek, small cooling is enough since the processor are more stable and efficient.. imagine mediatek using as big cooling system as SD Elite..",2,Electronic-Judge4602,1738678881.0
1if0pv4,mafbxxg,I third it.,1,GrahamBBB,1738438365.0
1if0pv4,mal22o3,"They both are good.
Since you need 1Tb, your only options are chinese roms.

In that case id go for the Vivo.
Camera and screen are better imo.

All the rest is pretty much the same on both.
If it was global, than no doubt the X8 Pro.
ColorOS is super nice.",2,SpaceToy,1738517202.0
1if0pv4,mal7h3d,"Appreciate that, I know Chinese versus global is a big thing, so that's helpful!",1,FlabDaddy7654,1738518665.0
1i4ycat,m800g4l,Back up your data and factory reset the phone. Sometimes there are bugs in updates and doing a reset solves the issue,2,Longjumping_Ad1434,1737303122.0
1i4ycat,m85wya7,I agree. The latest update screwed up the battery life. Also have overheating issues. I hope they fix it with the next update,2,Intelligent-Form5678,1737383268.0
1i4ycat,m7z6vkj,Your app usage is different...? Use the exact same apps and a 1:1 matching usage percentage of them and then we can talk.,1,Opposite-Working727,1737293377.0
1i4ycat,m80wxhs,"I've had a X5 Pro back then where I witnessed my battery life deteriorate with each subsequent update, from a very respectable 7-8 SOT to 4 hours SOT a year in. Your best bet is to hope for the next monthly update to see if it'll bring any improvement.",1,XVCXII,1737312240.0
1i4ycat,m80nbf2,That's not a feasible solution at this moment. 😐 I've lots of data and it will be a tedious process,1,Reddit-0fficial-,1737309557.0
1i4ycat,m85c380,"That's what I did, and I have had improvements (it doesn't even last 11 hours but I use social media a lot)",1,Human-Advertising-29,1737374539.0
1i4ycat,m8mzj4i,Why would someone ever lose all their data just to get a 2 hours longer screen time?,1,Petar_srb-,1737591834.0
1i4ycat,m87fcmg,"Luckily, I don't have heating issues till now.",1,Reddit-0fficial-,1737398703.0
1i4ycat,m7za8j0,"Yeah, app usage is different in the screenshot. 
But, I'm observing this less battery backup for almost a week with similar usage as before.",1,Reddit-0fficial-,1737294707.0
1i4ycat,m80xu32,"Yeah, hope it will get resolved with next update . 🤞",1,Reddit-0fficial-,1737312494.0
1i4ycat,m8beo12,You needed to do a factory reset. I get 6 hours 30 minutes to 7 hours SoT now,1,Longjumping_Ad1434,1737446696.0
1i4ycat,m8ovh75,You won't lose the data if you back it up to Google beforehand,1,Longjumping_Ad1434,1737618594.0
1i4ycat,m8cgnml,I wish I could. The phone died 11 months ago from a dead motherboard 🙃,1,XVCXII,1737466787.0
1i4ycat,m8znix1,"You can't back up everything,and the pics would already fill the space in google back up",1,Petar_srb-,1737756619.0
1h8wx4o,m0zxeup,"How long was your MLBB gaming session? I am curious about the battery toll while gaming. I can only do a maximum of 5 hours of MLBB on my X7U, sadly.",7,XVCXII,1733640742.0
1h8wx4o,m144imi,"I was going to get one just for the battery life, but I'm going to hold another year as the upgrades might be ever bigger to me. Coming from a pixel I think the jump would be huge.",5,IWantAGoodBattery,1733702367.0
1h8wx4o,m10ngct,"[https://i.imgur.com/MMN5gt5.jpeg](https://i.imgur.com/MMN5gt5.jpeg)

It's incredible",2,jimmeyotoole,1733657905.0
1h8wx4o,m14m41s,I have it too!!! Love the battery life!!,2,Local_Effort_5904,1733708826.0
1h8wx4o,m16cv88,Yep play MLBB on mine for hours and gets warm at best. Can play for hours and still have around 60% on balanced mode. Smart rapid charge on the phone is back to full in 15-20 mins. They really did well with the cooling and overall performance on this thing,2,International-Cap473,1733741523.0
1h8wx4o,m106w9b,My battery with this phone is nowhere near as good,1,jaju123,1733646810.0
1h8wx4o,m10w827,"Your phone is on 1% brightness this whole 8hrs or something? My X8 Pro is nowhere near this result, my max is like 7:50hrs..",1,rovian,1733662907.0
1h8wx4o,m0znt3o,Oh no did 1+12 disease made its way here,-6,lolicekait,1733635668.0
1h8wx4o,m0zxhg8,3 and half hours at ultra graphics,4,TheXclone,1733640783.0
1h8wx4o,m10xgx7,That's not bad at all :D,2,National_Depth6735,1733663499.0
1h8wx4o,m107nwc,"Did u update software?
It was like 1.18 gb update 
It was camera skin tone and system fix",1,TheXclone,1733647329.0
1h8wx4o,m10yf7d,"Lol no, half brightness when I was home...
Full brightness when I was out...
When watching 3 episodes of Day of the jackal then the MX player was at full brightness...
Only time it was at lowest brightness when I was sleeping around 6 Hours only",2,TheXclone,1733663935.0
1h8wx4o,m0zrmol,What do u mean?,4,TheXclone,1733637530.0
1h8wx4o,m103wnv,That is really good. Thanks for sharing (-:,4,XVCXII,1733644806.0
1h8wx4o,m11gzsj,"Tbf, MLBB is not exactly the most intensive game out there, and 5hours is from fully charged to an empty tank. The newer D9400/Elite are at least 20% more power efficient when it comes to games, at least from the games(HoK) from Geekerwan's in-depth videos.

Still, I am not complaining though - I am just curious about the battery prowess of the X8P (-:",3,XVCXII,1733671433.0
1h8wx4o,m107rms,"Yep I have that

https://preview.redd.it/rx1sm1ts7l5e1.jpeg?width=1080&format=pjpg&auto=webp&s=0268cf7f9b430bc10634bb08bd2c18f155726aeb

This is my normal usage",2,jaju123,1733647399.0
1h8wx4o,m107xpl,"15 hours since the last charge is fine bro, don't worry
As per my knowledge ur phone can easily last till 7-8 hours",2,TheXclone,1733647513.0
1h8wx4o,m1ntg43,Hey I have the same issues but with oppo find x8. Did you find out the solution? I intend bring it back to the retail store to change another x8,2,Alden_badass,1733989020.0
1h8wx4o,m1nttb4,My battery has got better with use over time. It's probably not worth switching units,2,jaju123,1733989259.0
1i884fy,m8rcu6p,"I bought an ""original case"" from AliExpress and the phone looks legit in it. Can recommend as it's very inexpensive, and with raised corners the screen is protected pretty well.",3,lukeroux1,1737654309.0
1i884fy,m8sdeco,"https://preview.redd.it/7earn3r00tee1.jpeg?width=4096&format=pjpg&auto=webp&s=5a8f794aa43243230f549de919fd2e6501a3bd6a

I stupidly bought five cases for the X8P - first a dirt-cheap clear plastic job, two 'leather'-backs (one with a kickstand), the Nillkin and the official Oppo.

The Nillkin looked the best, was the grippiest, and the lens cover/stand was great but it was the heaviest and I felt it didn't protect the edges of the screen enough. It was also the only one that didn't play nice with wireless charging. Both the leather-backs felt cheap and the green one was a bit loose at the corners. The official Oppo was obviously strong but didn't protect the sides at all and didn't cover the corners as well as the Nillkin, or provide any cover for the camera island.

So, for me, the best was the first and one of the cheapest, the Carinacoco clear case from Amazon. Bumpers covered the corners well, there was some lens protection, and a lip was raised all round the screen to protect that curved edge.",2,roomyverse,1737664276.0
1i884fy,m8r4hm6,"I really liked this one from Ali
https://a.aliexpress.com/_EwXzHrE",1,IWantAGoodBattery,1737652005.0
1i884fy,m8r7hg1,"I went caseless so far and it will continue to be my main approach, but I just ordered the following on Amazon https://amzn.eu/d/cCrqe6z since the weather in my place is freaking cold now and one hand holding outside is tough sometimes.



I'll update once arrives.",1,Naive_Banana4447,1737652838.0
1i884fy,m8spkk0,"https://preview.redd.it/4stp0unv9tee1.png?width=1264&format=png&auto=webp&s=85e89cf932f76072bec6e6fc0fe258479c7a8460

I use this one from Ali express, but after a few weeks the sides have started wearing on the corners a bit as there is no padding, just plastic. Looks nice though. [https://a.aliexpress.com/\_EuB3V2o](https://a.aliexpress.com/_EuB3V2o)",1,There_are_many_me-s,1737667586.0
1i884fy,m8vn447,"I got this one: 【淘宝】假一赔四 https://e.tb.cn/h.TmfCOHPnGElF8Ls?tk=Di2BeVoyaNJ HU591 「Conga适用OPPOFindX8手机壳X8 Pro凯夫拉芳纶碳纤维防摔硬壳X8新款超薄磁吸商务男士保护套全包磨砂散热后盖」
点击链接直接打开 或者 淘宝搜索直接打开

If you can get something like this, it'll likely be the best case you can get. Thin, grippy, premium. Actual carbon fiber.",1,soumen08,1737706378.0
1i884fy,m8s5adx,Could you send us the link?,2,Human-Advertising-29,1737662031.0
1i884fy,m8rv6ff,"mine is on its way, and I ordered this one too to see which is better

[https://a.aliexpress.com/\_EJHtwN2](https://a.aliexpress.com/_EJHtwN2)",1,runciter0,1737659291.0
1i884fy,m8yyf2v,Yeah the original one is great. 5 bucks from Ali. No idea if it's genuine Oppo but feels great and cut out for the camera button makes it far easier to operate,1,NeighborhoodDry2457,1737749474.0
1i884fy,m8sdxm0,[Clear Case from Amazon](https://amzn.eu/d/cOJ4UPE),1,roomyverse,1737664426.0
1i884fy,m8r8ltg,"Well, it's gorgeous, I'm going to see if I can find it on Amazon Spain",2,Human-Advertising-29,1737653149.0
1i884fy,m8sbxvu,"
https://a.aliexpress.com/_Ev8aBk4",1,lukeroux1,1737663875.0
1i884fy,m8r8u5t,"Hopefully it is functional as well, there is only one review from an Italian who really satisfied",1,Naive_Banana4447,1737653213.0
1i884fy,m8r9xal,Looks good if you love coque,1,jaju123,1737653514.0
1i56zyi,m81h53r,"No pay, no Android auto and some band missing",1,Morveuse,1737318044.0
1i56zyi,m84kd0k,"I have been using for four weeks. In Poland, payments work, banking apps too. Problems with lack of one GSM band I have not noticed.",1,Dick1am,1737357606.0
1i56zyi,m81jd31,Thanks for confirming !,1,Shuuzai,1737318685.0
1i56zyi,m84lh5m,"Thank you!
That's interesting, so no issues with the google wallet payments and banking app using x8 find pro CN version in Poland.",1,Shuuzai,1737358243.0
1i56zyi,m86pghz,Czy jakieś części interefejsu sa w języku chińskim? Czy masz jakiekolwiek problemy związane z tym że to chińczyk a nie z europy?,1,Trelsonowsky,1737391740.0
1i56zyi,m88mzl0,how much did you pay for the chinese version?,1,onestep87,1737410443.0
1i56zyi,m888er8,I got an Oppo Find N3 CN ROM and was able to use Google Pay with my MasterCard for NFC payments.,2,YakorL,1737406570.0
1i56zyi,m84nvuu,"Sorry I didn't read it. I have an X8 (without pro), but surely with the pro version the situation would be analogous.",2,Dick1am,1737359648.0
1i56zyi,m8m1q3t,"Tak, zdarzają się elementy interfejsu w języku chińskim, ale nie jest ich aż tak dużo aby kłuły w oczy. Problemów jako takich nie zauważyłem. Obawiałem się braku jednego pasma, ale jak do tej pory nie doświadczyłem braku zasięgu.",1,Dick1am,1737581613.0
1i56zyi,m8m232y,About 650 euros,1,Dick1am,1737581710.0
1i56zyi,m88cllv,"Perfect, thanks! Although it's not the phone I am looking for, there's no reason it won't work on oppo x8 pro.",1,Shuuzai,1737407675.0
