Post ID,Comment ID,Text,Score,Author,Created
1hm2erb,m3qs1oy,"It's a fantastic, well rounded flagship smartphone. The camera is great, the battery phenomenal and the OS smooth and fluid. 

I've had a Pixel 9 Pro XL, S24 Ultra and iPhone 15 Pro Max this year and I can comfortably say the Oppo Find X8 Pro is as good if not better than all 3 handsets. You won't regret getting one.",23,CoolbananasKD,1735140451.0
1hm2erb,m3rr2ud,"Bro I am loving the x8 Pro phone, this phone is complete all rounder. Amazing camera Amazing display for multimedia OS is so smooth and full of features And battery life is out of this world I have played these 2 games in ultra graphics mode. My screen resolution and refresh rate is selected at max Display color is vivid selected And still see the result

https://preview.redd.it/3xg7pdjgn19e1.jpeg?width=1264&format=pjpg&auto=webp&s=0e5aed2dc65985f5e809941933a47bad15cea79b",8,TheXclone,1735153921.0
1hm2erb,m3qzbhb,"I have mine since last Saturday. My previous phone was an iphone 13 pro. 

I bought my X8 pro for 899€, which was the maximum I wanted to spend on a phone. But I do have to say I really like it so far! 

Battery is great, UI is very smooth and responsive. Camera's feel like a huge step up compared to my iphone 13 pro. Comes with some features I will try out next week when im having a small holiday. 

I do need more time to fully adjust to android again and set things up exactly how I want and like it. 
I feel the phone is very slippery tho, so a case is on the way. Im too afraid to drop it right now. 

All in all, I give it a solid 8/10. It feels like a huge upgrade from the 13 pro and I have no regrets switching.",3,NINJATONYSOPRANO,1735143419.0
1hm2erb,m3qvwa9,Any particular reason you're considering it more than the OP13?,2,iamdonnigli16,1735142045.0
1hm2erb,m3qw09y,I've just ordered one after debating between the OnePlus 13 and the X8 pro. Probably won't receive it for another week or so with it being Christmas but I'm excited to receive it!,1,,1735142090.0
1hm2erb,m3reqh2,"It's amazing, a complete smartphone.",1,lukeroux1,1735149358.0
1hm2erb,m3rs5bh,Loving mine. And upgrade from my Findx2 Pro which is still pretty good by the way.  The camera zoom is awesome.  And all the other stuff.,1,GrahamBBB,1735154319.0
1hm2erb,m3t8owh,"I recently upgraded from the Pixel 7 Pro to the Oppo Find X8 Pro, and I can confidently recommend the Find X8 series.

What sets this phone apart isn’t just its impressive hardware—it’s the software. ColorOS 15 is packed with practical, daily-use features that truly enhance the overall experience. It’s a fantastic upgrade for anyone looking for a feature-rich and reliable device.",1,GS-Rolex,1735175123.0
1hm2erb,m3u8160,"Used the Find X8 Pro for about a month as I won it from a contest. Previously used an S22 Ultra, and currently on the iPhone 16pm. 

The whole UI is smooth and sleek, somewhat similar to iOS if you are coming from Apple. Cameras are also great, much better than the S22 Ultra that I was using previously, but for shooting people it seems that the processing of the iPhone does it better. 

Only gripes I had were the weight and finish of the phone. The finish made the phone extremely slippery, and the light weight of it made it feel a little bit cheap for a premium phone. But that’s just me, it could be a good thing for you.",1,shootingrays89,1735192045.0
1hm2erb,m4249ff,"Any idea if the regular Oppo X8 comes to Europe? Can't believe the X8 isn't available when it's more comfortable, affordable and very well balanced in size. ",1,Spare_Reference1505,1735319805.0
1hm2erb,m4mdmnh,"I moved from S23 Ultra to Oppo find x8 pro. Its worth it. Excellent camera, Battery life , coloros is like fluid pixel like experience. I'm just amazed how far this phone came. It's just outstanding ",1,ashzx7810,1735608478.0
1hm2erb,m4ojvzi,"I love it! The camera is fantastic! It has good speed and efficiency. I charge it once every 2 days, the battery is amazing. Had Oppo for over 12 years ",1,Princess_BundtCake,1735647287.0
1hm2erb,m6kj0ha,"Just saw the specs for the OPPO Find X8 Pro, and I’m blown away! The 32MP front camera is perfect for selfies, and with 4K video recording capabilities, I can’t wait to capture high-quality content. The design looks stunning, especially in Pearl White! Plus, with 16GB RAM and 512GB storage, this phone should handle anything I throw at it without lag. I’m also excited about the AI LinkBoost feature for better connectivity in crowded places—perfect for concerts! Has anyone pre-ordered? Would love to know how the experience has been so far.",1,Legitimate_Throat282,1736600610.0
1hm2erb,m3rmd71,"The AI feature that you can not disable in the camera app sucks, it changes people faces too much. Adds extra teeth or changes race. Skin tone was updated to be better in a software update but no option to turn off the damn AI.


You need to download open camera and use api 2.0, then fidget around the settings, total crazy.


If you do not like AI fake photo's, avoid this phone.",-2,Blobjair,1735152169.0
1hm2erb,m3teojv,"If you don't care about your personal data and information you can jump the gun.
However for having OOS 15 and COS 15, I still can understand how people can say the OS is smooth.
Tons of bloatwares, full of micro lags, not to mention intrusive at a point if you don't opt in, the OS has absolutely no functionalities they advertise for.
At least Samsung let you use AI locally and secure your data. At a time where brands are swearing only with AI (translate, screenshot, zoom, services, network...) that's definitely a functionality OPPO doesn't have as they literraly explain in their cluff every frame are compute, screened and sent back to their country to be share with 3rd party providers...",-2,M1K4_3L,1735177745.0
1hm2erb,m3t9di7,"Not OP but great to hear, I've switched from Z Flip to Pixel 8 Pro to S24U and now Nothing 2a Plus but none of them have really satisfied me. Also looking to switch to Find X8 in a couple months.

How would you say video zoom transitions are on it? I found S24U to be a bit rough with that",3,TabascoTaco,1735175419.0
1hm2erb,m4ud8ka,Thinking of getting one myself. Does the oppo have some sort of version of routines?,1,Aliiza,1735736755.0
1hm2erb,m86uf4j,"Hi! Is it possible to disable UltraHDR mode in camera?
I just got OnePlus 13 and turning off HDR off doesn't work. It still shows UltraHDR in Google Photos and photos do have HDR brightness embedded what I really don't like about it. 
Also another question. Coming from Pixel, isn't Oppo software too ""chinese""? I really like Pixel OS and Oxygen OS as well.",1,Majezan,1737393103.0
1hm2erb,m8vnou9,On mine I think the camera works too much with AI in my opinion. I'm getting some very fake images sometimes which is a shame. The hardware is great but camera software feels a bit too much for me,1,preciouscode96,1737706725.0
1hm2erb,m4j2eor,"Damn bro, get some rest",2,Bromanosu42,1735570357.0
1hm2erb,m8vnnnh,On mine I think the camera works too much with AI. I'm getting some very fake images sometimes which is a shame. The hardware is great but camera software feels a bit too much for me,1,preciouscode96,1737706704.0
1hm2erb,m3r7nju,"Good experience with oppo, If I buy oneplus I'm stepping into new territory as i never bought from them before. op would be around the same price as the oppo, while the camera for oppo is way better, OP has a better display and fingerprint sensor, im willing to trade camera for display and fingerprint sensor honestly",2,Upstairs_Kitchen_980,1735146647.0
1hm2erb,m4hi5uu,i went to oppo stor to experience the demo model damm i was blown away i completely forgot about samsung and iphone how can this phone freaking be so smoothe i open twitter or any other apps it dosent load its like it opens in that 1 sec already fully loaded the page crazy the camera is also really good af the design looks sleek espically the black one i fell in love with its design at first glance.,2,HeatEducational6987,1735539824.0
1hm2erb,m4udhdp,"Does it have Routines or some sort of similar software? Also, can you tell me what software parts you're missing on the oppo? Thinking of making the switch from an s24, concerned about losing secure folder and routines.",1,Aliiza,1735736880.0
1hm2erb,m6km7o2,Lol this legitimately sounds like a sponsored comment,1,Upstairs_Kitchen_980,1736602064.0
1hm2erb,m3t8o0z,"In the ""master"" mode, the very last one on the left in your camera app, all AI is disabled, all filters are disabled.",5,bag1blant,1735175112.0
1hm2erb,m3vlf87,"Much smoother than the Pixel and Samsung, probably ever so slightly less smooth compared to the iPhone but still very good. It's probably the best transition I've seen on Android - true for the smoothness overall as well, it's a very fluid smartphone.",2,CoolbananasKD,1735222962.0
1hm2erb,m8w39jl,"You can use Master Mode in auto settings and it's far less HDR focused. I'm not sure if it's the same for the OnePlus 13 but they both use essentially the same software so I'd imagine they must have an equivalent? 

I came from a Pixel 9 Pro XL and have to say the OS is very well refined and slick. The main difference is little quirks like the ""dynamic island"" copy that Oppo uses and the notification/control centre is more iOS but beyond that you can make it as stock or as Chinese as you like. I'd say PixelOS, ColorOS and then OneUI in that order for me anyway.",1,CoolbananasKD,1737716276.0
1hm2erb,m8w3gvn,"Yeah that's probably a fair criticism, if you use Master Mode in auto it's much less AI led and the photos have a much more natural/neutral feel to them.

The latest update has improved the camera processing too, I've not noticed much yet as I only updated yesterday but have seen others mention improvements. Have you updated?",2,CoolbananasKD,1737716392.0
1hm2erb,m4j4cre,Lol 😆 will do bro,1,TheXclone,1735571049.0
1hm2erb,m8vs1dw,"In this case I would suggest u try the master mode.
Master mode keeps pictures raw",1,TheXclone,1737709427.0
1hm2erb,m3r8nno,"I'm in the same (read opposite) boat as you. I've never bought from oppo but have always had a good experience with Oneplus. With the announcement of Project Starlight combined with the computational photography slowly improving and an ultrasonic fingerprint scanner, Oneplus seems so much more enticing.

I absolutely love the design of the oppo though. Just wish they didn't place the fingerprint sensor so low and it wasn't optical.",2,iamdonnigli16,1735147040.0
1hm2erb,m4inleh,I mean the oneplus has noticeably better hardware than the oppo and similar enough software. I don’t see why anyone would go oppo other than the looks.,1,iamdonnigli16,1735564402.0
1hm2erb,m3upsxz,"For photos, not for video",2,Blobjair,1735204189.0
1hm2erb,m8xrxu7,"Yeah I've used the master mode more now and I'm glad you can set an option to use 'last photo mode' when opening the app 

I did update yes! But not really test the camera out before and after updating unfortunately",1,preciouscode96,1737737614.0
1hm2erb,m8vylfs,Yes that's true! Thanks,1,preciouscode96,1737713495.0
1hm2erb,m3rb1pp,Yeah the fingerprint is a bummer i don't know why they didn't opt for a ultrasonic one when the rest of the competition has moved on. The OP13 also has the latest snapdragon which i kind of prefer but then again with my s22 plus the battery was horrible with the snapdragon 8gen1,2,Upstairs_Kitchen_980,1735147967.0
1hm2erb,m3rbkk5,"I have an s22 right now and the battery is absolute dogshit. I thought replacing the battery would help but it didn’t do jackshit. 

I think the 8G1 just has poor efficiency. The 8 elite is supposed to be one of the most efficient chips. Ugh, i’m so conflicted. Please keep me updated on your decision and experience!",3,iamdonnigli16,1735148165.0
1hm2erb,m3rd8da,"Sure, yeah s22 was horrible Samsung support on the screen for me was terrible as well, they are saying the mediatek processors have 90% the power of snapdragon but way more power efficient which means less heat and less throttling, more stability and more battery. Would have seriously considered OP13 as well but OP exists as like a digital store where i live and most of their servicing is done through the same place as oppo here anyway. Op13 hasn't even been announced in my local oneplus website yet. Oppo in comparison is more popular here in that sense",1,Upstairs_Kitchen_980,1735148790.0
1hm2erb,m3rdtug,Have you considered the X200 series?,1,iamdonnigli16,1735149014.0
1hm2erb,m3reeez,"I did but also doesn't exist in Singapore yet sadly. When I was buying the s22 2 years ago I was looking at the x80 pro, the last flagship model from vivo to be released here, should have gone with that but it was 1600 dollars crazy nevertheless should have went with the vivo anyway, it would still be going great right about now. Vivo software though compared to the rest is still subpar ig that's the only negative that I've seen from the x200, otherwise best camera in the game, top 2 processer, can't go wrong with the phone, only issue if you were to nitpick would be funtouch os",1,Upstairs_Kitchen_980,1735149229.0
1hy3b14,m6eap8l,"Find x8 pro has better/more cameras, longer big updates support 5 vs 4 years, dedicated camera button.",31,lukeroux1,1736514737.0
1hy3b14,m6e803k,"It doesn't make sense to me either. The oppo definitely has the slightly better camera but it is very close. 

The microphone on the OnePlus is far better from the sound tests I've heard, which makes it better for calls and also picking up audio in recordings. OnePlus also has a slightly bigger battery and slightly faster charging but you'll barely notice the difference. The fingerprint sensor is ultrasonic on the OnePlus whereas it's optical on the oppo so it's a bit quicker. Screen on the OnePlus also works better with gloves. 

I do think the oppo find x8 pro is a slightly more attractive phone though.",7,Internetolocutor,1736513612.0
1hy3b14,m6eslro,"Honestly, these two phones are so close to each other their differences are probably negligible. One is a little better than the other at some things but in the end the hardware is practically even.

The real reason why there's price differences is because of the region variants being different. 

If you're in the US, the global model 13 is easier and cheaper to get than the global model X8 Pro because the X8 Pro doesn't sell here. You have to import it. And the global models are always more expensive to import, usually adds about $400-$500 to the total cost.

However, the Chinese model 13 and X8 Pro are cheaper than their global model counterparts, so in some cases if you import the Chinese model of either brand, you could possibly get either one cheaper than what you'd get the global 13 for.

Problem is, the Chinese model isn't fully compatible with US carriers (if you're in the US that is) so you'll run into some compatibility issues like trying to use Verizon/AT&T and then some intermittent problems with Google services too. A lot of people don't really care about that though, especially if you have strong T-Mobile service and you don't use many of the picky Google services that don't play nice with different region devices.


I bought the 13 because, besides phone preference, it's easier to get and fix if issues arise because OnePlus is local, and I don't have to worry about possible region compatibility issues (even though I use T-Mobile, I use rural bands that China models don't support). I bought mine from a Best Buy store just a few hours away.",4,TheOriginalElTigre,1736521150.0
1hy3b14,m6g4eja,"Oppo has better camera but not by much, OnePlus had better screen, fingerprint sensor, processor, battery, charging speed and imo a better OS even though they are very similar, all around imo a better choice and cheaper is OnePlus",2,ErikCirez,1736535171.0
1hy3b14,m97vbvp,Oppo seems to have better video zoom.,2,Fit-Atmosphere2075,1737867203.0
1hy3b14,m6eb0ix,The OPPO is cheaper for me. Oneplus 13 starts at $899 here in the USA while the OPPO starts at $799(giztop.com),4,Major_Enthusiasm1099,1736514864.0
1hy3b14,m6e7f5s,"Oppo has always had better specs in the Find X series.

Edit: don't downvote objective facts just because you are personally unfamiliar with Oppo. Oppo is a premium brand and owns OnePlus, which has traditionally been a step below premium.",3,leidend22,1736513361.0
1hy3b14,m6eqbmf,"510 ppi vs 450 ppi. And yes, I can see the difference",2,haRT3r,1736520411.0
1hy3b14,m6egyzg,The find x8 is cheaper where I am.,1,FuckSpezzzzzzzzzzzzz,1736517129.0
1hy3b14,m6emltx,Where I live (EU) OnePlus saves money by selling exclusively online.,1,j03ch1p,1736519144.0
1hy3b14,m6eswsl,"The Find X8 Pro is a legitimate Pro model while the 13 is slightly cut down. 

OnePlus found that people weren't interested in paying Pro prices so they stopped doing Pro models.",1,Ethrem,1736521248.0
1hy3b14,m6exp6h,"Each to there own, I didn't like the oppo and sent it back. What is with this dedicated camera button rubbish, so unnecessary. Also what played into my decision is I couldn't get their official case anywhere... Like who sells and phone without them stocking the official case on day one FFS.

Anyway, each to their own but Oneplus are better in my own opinion.",0,Demonicale37,1736522754.0
1hy3b14,m6hvpd3,OnePlus better display and Snapdragon . Winner,0,Brave-Purchase-4582,1736554726.0
1hy3b14,m6edvwn,certainly better zoom yes,9,tec7lol,1736515988.0
1hy3b14,m6ehpdg,But Oneplus 13 has 5 OS and 6 Security updates promised.,-8,SilverBladeCG,1736517396.0
1hy3b14,m6ernbr,can u share 1 2  url of youtube videos abt microphone tests i m interested,3,Old-March-5273,1736520845.0
1hy3b14,m6w8wee,"battery but due to screen being 2k the power consumption + snapdragon actually consume more power than mediatek this time around - although it does give a bit more frames in game lol .

They also pushed an update from oneplus ace 5 pro - that optimised for gaming to oneplus 13 (these couple of days)",1,MVP_Troll,1736760031.0
1hy3b14,m6eknja,But is that $799 for the X8 or X8 Pro?,2,BewareTheSquare,1736518465.0
1hy3b14,m6gfftr,You are comparing global model to chinese imported price. The fact is in Europe where you can buy both Find X8 Pro is more expensive phone.,2,iceleel,1736538386.0
1hy3b14,m6e8wfu,"Hi, OnePlus 13 has a SD8 Élite that the Oppo doesn't have. Correct me if i'm wrong.",4,TheKuter,1736513993.0
1hy3b14,m6w93v4,"I do find Oppo X8 Pro is like downgrade of screen but upgrade for camera from Oppo X8.
While oneplus 13 is like similar camera set up of X8 but with better screen and fingerprint scanner with snapdragon instead of mediatek.

TLDR: Some people in china actually call oneplus13 the Pro version of X8.",2,MVP_Troll,1736760169.0
1hy3b14,m6hvvw9,The pro is the cut down one.,1,Brave-Purchase-4582,1736554787.0
1hy3b14,m6ehywf,Does it? Last time I read about 4.,16,lukeroux1,1736517493.0
1hy3b14,m6eyoff,It's 4 and 6 sadly,9,Pankaj135,1736523053.0
1hy3b14,m6elb54,"X8 Pro. I'm looking on giztop.com since I'm in the USA and OPPO doesn't sell phones here. I'd get the oneplus 13 here in the USA but if it's in a region where that phone is sold and it's $799, then I'd buy that instead if the oneplus still costs more",-2,Major_Enthusiasm1099,1736518695.0
1hy3b14,m6e98q4,"They are in the same class tho, both flagship SoCs with flagship modems and performance. 8 Elite is only slightly better.",5,Jordytjes,1736514138.0
1hy3b14,m6glgow,You would never notice the difference. Dimensity 9400 is top class and made by TSMC. It's not an Exynos/Tensor POS.,1,leidend22,1736540143.0
1hy3b14,m6i00z4,It's got additional camera hardware and the hardware otherwise is quite similar (Dimensity 9400 sucks for emulation but it trades blows with the 8 Elite otherwise).,1,Ethrem,1736556188.0
1hy3b14,m6en3ny,"OnePlus 13 is $699 on Giztop. Also both are Chinese versions which are consistently cheaper, be cognizant of band support.",11,HORSELOCKSPACEPIRATE,1736519315.0
1hy3b14,m6eoc7k,"Oh wow I didn't realize the price went down, I see it's $899 for the 16GB 512GB version, just like the 13's early special. 

Yeah it sucks we don't get Oppo phones here in the US anymore, otherwise I would've gone for the X8 Pro instead. But hey the OnePlus 13 is the closest we're getting to an Oppo phone.",2,BewareTheSquare,1736519743.0
1hy3b14,m6eyuoy,You are comparing a global OnePlus to a Chinese Oppo. Compare both global or both CN,2,cliffr39,1736523105.0
1hy3b14,m6ekjn3,"From what I've seen, the 9400 tends to do better in things like video editing.",3,BewareTheSquare,1736518426.0
1hy3b14,m6eshhe,The modem in the 8 Elite is way better. Qualcomm is the only company on the planet who makes a 5G modem that can hold a signal in a fringe situation.,3,Ethrem,1736521111.0
1hy3b14,m6ea3v0,"Ok, thanks for your fast reply. SD8 Élite is far better than others for émulation no ?",1,TheKuter,1736514494.0
1hy3b14,m6i4lo0,Snapdragon is always better optimised. OnePlus 13 has a better display panel.,3,Brave-Purchase-4582,1736557743.0
1hy3b14,m6f1hms,Yeah the Chinese version doesn't have all the bands that the global version has and it might not support eSim here in the USA,1,Major_Enthusiasm1099,1736523909.0
1hy3b14,m6etboy,"This is not what I have experienced so far. Latency is better on the 9400. Signal seems fine everywhere, also on places I know dont have signal. And no battery drains when theres bad signal, cough Exynos modems.",5,Jordytjes,1736521382.0
1hy3b14,m6i0hmi,Yes it is. MediaTek doesn't freely release source code and Mali is poorly supported anyway. There are some obvious MediaTek fanboys downvoting people in here.,1,Ethrem,1736556345.0
1hy3b14,m6edr3h,No,1,lukeroux1,1736515937.0
1hy3b14,m6edrma,"no, I would say they are the same.",1,tec7lol,1736515943.0
1hy3b14,m6igo3l,"For the average person, the extra camera would win them over. I have a 12 and a 12R sitting here... You have to really be looking to see the difference in the resolution. I don't know that it would matter to most people even though you're technically right (and it would matter to me).",2,Ethrem,1736561874.0
1hy3b14,m6f4h47,"If it were not for the carrier bands, I'd bought the Chinese version.",1,iredditshere,1736524796.0
1hy3b14,m6w8oy3,"but if so, the oppo china version also wouldnt support esim lol and global bands lol then its not a fair fight, unless u comparing both china version since both missing same shit then it will be 699 vs 799
then oneplus with esim, bands is 899.

I am in asia - both phone is sold, 
oneplus 13 is 950, oppo x8 pro is 1150, x8 is 950.",1,MVP_Troll,1736759892.0
1hy3b14,m6etpe6,There's never once been a modem tested against Qualcomm's flagship that beat it in a fringe situation so I'm going to press F for doubt. I don't trust anything but Qualcomm.,-1,Ethrem,1736521503.0
1hy3b14,m6igs1s,It's not just the resolution. It's a newer and better panel. Ultra sonic fp scanner is better too,1,Brave-Purchase-4582,1736561911.0
1hy3b14,m83z7tk,"For the average user, the name snapdragon, higher charging speed will probably took them over.",1,yurnero12328,1737347155.0
1hy3b14,m6euoih,"The unfortunate thing is that modems dont really get tested. So we dont know for sure, but believe me, I have used Exynos modems, Qualcomm and now my first MediaTek modem. 

There's really nothing wrong with the MediaTek modems. No battery drains, good signal, n78 gets picked up in the same places als my OnePlus 12 did for example. And the latency is much better, something I also experienced with modems in the Huawei phones back in the day (Kirin).",4,Jordytjes,1736521812.0
1hy3b14,m6gm06a,Your assumption-based feelings on things isn't relevant.,0,leidend22,1736540303.0
1hy3b14,m6evk3n,I learned my lesson with straying from Qualcomm. Maybe in another 10 years I'll give another modem a try but Pixels just ruined any other modem for me and the Intel one in my XS Max was awful too.,-1,Ethrem,1736522087.0
1hy3b14,m6gnp1v,"Prove me wrong then. If you can't, your reply is irrelevant.",0,Ethrem,1736540800.0
1h0znsf,lz7rh89,"Like you said, you dont play any games. Go with the S25U its long software support, powerful processor/camera and obviously Galaxy Ai. S25U looks like the best option for you. But OnePlus is also a solid choice in my opinion.",3,kafamasikcamkb,1732696964.0
1h0znsf,lz7si5s,wait for the s25 ultra,1,DurianRoyal,1732697648.0
1h0znsf,lz975m8,"OPPO find x8 pro (global version) 
Check reviews on YouTube.",1,National_Depth6735,1732721716.0
1h0znsf,lzdgsf0,"Bro Oppo x8 pro is an all rounder beast.
U will get 5 years of android updates and 6years of security updates.
Color OS is almost a complete OS, better than One UI
It's parallel processing is just top notch.
Oppo is giving you 6x optical zoom which is amazing.
(Check camera results on youtube, it leaves iphone 16pro and s24 pro way behind, iPhone's video is better as it gives u 4k with 120fps, but oppo gives u 4k 60fps, HDR, DOLBY VISION recording which I guess is enough)
Oppo has optimised mediatek 9400 much much better than any other device, no heating complaints like One Plus 13.
U will get 16/512 varient.
AI and OS fratures are amazing.
Display is again top notch 
1.5k LTPO amoled, HDR10+, 1 BILLION colors, DOLBY VISION.
It's much much better option.",1,TheXclone,1732777923.0
1h0znsf,m29ywcd,"Oppo Find X8 is 2024 phone of the year. Combination of Trinity Engine, 16GB RAM, Dimensity 9400 chipset, and massive lithium-carbon battery leaves everything else available right now in its considerable wake!",1,13rulesforlife,1734319955.0
1h0znsf,lz96xbj,"You forgot to mention one phone.. and that phone I better than OP13 , and possibly better than s25u.. 
OPPO find x8 pro is a beast.
Go check reviews on YouTube",2,National_Depth6735,1732721642.0
