Post ID,Comment ID,Text,Score,Author,Created
1guqega,lzwznjl,"Go for oppo, I have done lots of research and conclusion is Oppo find X8 pro is the best all-rounder phone, Nd purchase is from oppo estore u will get 
2 year manufacturer's warranty 
10k Discount from card
Oppo enco air 3 pro 
Type c data cable 
Car charger 
Chat with customer care via the oppo store app (download it from playstore) and they will give u a gift code...
Use it while checking out 
Earlier I have ordered from Flipkart then cancelled that order as they are only giving 2 year manufacturer's warranty and nothing else",1,TheXclone,1733081142.0
1guqega,m0c54ji,"If you click awesome pictures of the friends & family and immediately like their attention for how beautiful they look & keep chasing you for sharing pictures & all, then don't go for iPhone 16 PM. The photos are natural as hell in iPhone even though mighty accurate & clear photos.

Vivo X200 Pro should be your phone to go in this case bcoz that phone camera is fun as heaven. But but but FunTouch OS in Vivo looks very cheap to me. I had a X100 Pro but sold it bcoz of Funtouch & how childish it looks. Then, I thought of giving it another try for Funtouch OS 15, even though it is crazy smooth but still the OS is not matured looking.

If you want 96-97% camera of Vivo X200 Pro, which is awesome as well & excellent OS, please go for Oppo Find X8 Pro. Color OS & its flux themes are awesome & it looks excellent as well. So superb camera's & awesome OS win win situation. Cheers!",1,Shaikh7866,1733298007.0
1guqega,m3mxexl,how is the oppo so far? did you wish you'd get the vivo or iphone?,1,artursefuli,1735068594.0
1guqega,lxwdkmw,Honor magic 6 pro to study and maybe add to the list (?),-5,Drizz1911,1732005629.0
1guqega,lxwvcz6,"Thanks a lot for your valuable reply. Actually here ultra models of vivo,oppo will not come. Can be waited for Xiaomi 15 pro....but date is unknown. OP13 camera is subpar compared to vivo x200 pro and oppo find x8.May be I will go with OPPO because of color os. Apple is always a headache as I am a long time Samsung ultra series user. Now I am ditching Samsung only because of poor pwm frequency.",2,DemandAccording524,1732016875.0
1guqega,lxybecb,Do the Vivo or the Oppo come with esim in the global/Indian versions?,1,BambaiyyaLadki,1732035495.0
1guqega,ly1yaaw,I am not in apple ecosystem. Basically I have samsung watch classic lte and buds 2 pro as I was using S24 U. Now need to switch becuase of low pwm frequency and high modulation of samsung.,1,DemandAccording524,1732078906.0
1guqega,m4xx73i,Superior at what exactly,2,DanYeoman,1735781677.0
1guqega,ly1yvjn,Thanks brother . Now I am comapring between IPhone and Oppo find X8 pro. I was highly attracted by Apple but modulation depth and pwm frequency is the only reason for keeping Oppo bit ahead of Ip16 pro max.,1,DemandAccording524,1732079186.0
1guqega,lzfou45,"Indeed you are biased.
Apple is good professionally
Android is good playfully

Apple is super reliable, everything done smooth,good.
Android is experimentation, like 20 camera modes, 100 different options, tweaks, custom launchers etc.,


And now realme can airdrop to apple, and apple accepts RCS, reduce the exclusivity except facetime. Unless all my circle have apple, I cant leave 1 Android family/ friend and do facetime with rest. So that's a bummer and people will not use web facetime (alternative for Android users by apple) as they have many alt like whatsapp, signal.

That said Android cannot have smoother animations like apple.

And also apple cannot have custom launchers, not custom icons, not custom modded apps, adfree youtube for free and lot more features much more than the word limit on reddit.

Tech nerds should consider Android, professionals and others who want everything automatically done right should consider iphone.

Note - yes I'm aware you have youtube ++ for apple but that gets signing issue very often and custom icons is not 1 click away like Android.

Even processors, iCloud free storage, ai power is superior in Android.

Atleast samsung promised and gave the ai which apple is still testing, and samsung is free till 2025 but not apple.

And funny part - apple is supposed to talk about softwares and ai in WWDC and about hardware and phones in Apple launch event
But they spend 50% of time in Apple event to talk about AI because they had nothing else to speak.

That said I personally have used both and both have its own goods and bad and blindly saying apple is best doesn't makes sense.

From real life speed tests, to bench mark like antutu to dxomarks - Android just screws apple

And price, especially India. 

Note - apple manufacturing multiple models in India and still charges extra import tax as if they are imported.


And yes, apple last longer than Android, they issue updates instantaneously to all the models. Once you change battery after like 2-3 years it becomes brand new again.",1,Doctor_Paradox_001,1732815372.0
1guqega,ly1ymnc,"I will post soon with my new mobile. Actually I was a samsung fan and now want to switch because of eye peroblem due to samsung displays which is called pwm frequency. Don't judge without knowing the fact. Here I am seeking help as I have used IPhone, samsung and google . Never used chinese one.",1,DemandAccording524,1732079067.0
1guqega,lyclnlf,"Actually I am the chief civil engineer of tbm tunneling for  metro rail construction  in India. That is why I need it for my daily site work and multi-tasking. Also good photography is needed for my family .
So , please spare the reason. It's personal.",2,DemandAccording524,1732241643.0
1guqega,lydteru,I also moved from samsung s24 U. Booked x8 pro. Yet to deliver. But still thinking of 16 pro max.,1,DemandAccording524,1732261529.0
1guqega,lyuz582,Vivo is best but OS is garbage.,1,DemandAccording524,1732510122.0
1guqega,m1r63pc,"Is this offer still available? I can't find 2 yr manufacturing warranty in oppo estore . Also, how to ask for gift code?",1,Reddit-0fficial-,1734037664.0
1guqega,m3qwssl,"Oppo is good.Using find X8 non pro as the display is very soothing to my eyes. Far better than the pro version in terms of PWM frequency.
As a long term user of S22,24 Ultra user  I do miss the picture quality. The photos of Oppo are very much processed and lack quality.
If anyone needs social media ready pics then they should go for Vivo X200 pro or S24 ultra.
Color Os is very much better than Vivo but the same as Samsung. Apple I don't like as there are too many restrictions. Used Iphone for 3 months only and sold it.",1,DemandAccording524,1735142413.0
1guqega,lxwdo7f,Not available in india. Only global ver is selling but not suitable for indian sims.,1,DemandAccording524,1732005695.0
1guqega,lxxil83,"The iPhone 16 Pro Max also has poor pwm frequency, so that apple headache is guaranteed.",1,ArmedCrawly,1732026468.0
1guqega,lxye5l6,Yeah many Chinese phones i assume come with dual sim support one nano and one esim.,1,FinePersimmon3718,1732036317.0
1guqega,m0c5v5q,"No India has not embraced esim yet properly. Even Samsung doesn't provide esim option in india, which is excellent for theft control.",1,Shaikh7866,1733298480.0
1guqega,ly26v3a,"Vivo x200 pro get that with eyes closed but see there is lens flare issue in it but Vivo has one of the best service network in India so buy that when it releases.

I",1,FinePersimmon3718,1732083219.0
1guqega,m4zjjhz,Longevity,1,Dismal_Code_2470,1735811385.0
1guqega,lyre8wj,[removed],1,,1732466071.0
1guqega,lyuzwka,"I haven't checked any Vivo in person or in detailed review. But a bad UX and OS would be an issue for me, since my last 3 phones have been OnePlus 7t, iPhone 12 and pixel 7 pro. I don't need a whole lot of features, but don't enjoy to many gimmicks either. 
Maybe I should add pixel 9 pro to my list.",1,zhopudey1,1732510483.0
1guqega,m1r7u1q,The offer was valid till the pre-order and I don't know if the offer is available now however I will suggest you to speak with the customer care of oppo e store,1,TheXclone,1734038196.0
1guqega,lxxjy39,Yeh absolutely. That is why I am thinking about Oppo. Actually modulation depth is lesser on apple compared to samsung s24 ultra.That is why I am thinking about 16 pro max.On oppo it is quite good,1,DemandAccording524,1732026939.0
1guqega,m0c62kf,"I agree about how good cameras are, but a move from OneUi 6.1 to Funtouch OS is what something I don't suggest.",1,Shaikh7866,1733298613.0
1guqega,m509zvi,Yet Samsung is now doing 7 years of updates,2,DanYeoman,1735825753.0
1guqega,lyre8y8,"Hello zayzazta, unfortunately your account does not meet the minimum requirements to make a comment in this subreddit. All users must be at least 2 weeks old to participate. This measure is in place to prevent ban evasion and brigading. 

*I am a bot, and this action was performed automatically. Please [contact the moderators of this subreddit](/message/compose/?to=/r/PickAnAndroidForMe) if you have any questions or concerns.*",1,AutoModerator,1732466072.0
1guqega,lyv0ago,"Same here....my last 3 was S24 Ultra,S22 Ultra and Note ultra.But because of the bad pwm display I have to ditch samsung now. But Iphone camera is very poor for Indian skin tones. Also I have android and windows device with me . So I have to go with find X8....but still thinking of iphone 16 pm",1,DemandAccording524,1732510669.0
1guqega,m1r8n2h,"Thanks for quick response, I'll do that.",1,Reddit-0fficial-,1734038446.0
1guqega,m0c5l70,"Along with pwm headache, you will get iOS headache also for how limited iOS is & how lifeless the photos look. I bought iPhone 16PM & sold in just 1 week as I was coming from S23 U. My Sister hated her 3 month old daughters photos on iPhone & started yelling at me, saying my daughter doesn't look so bad she is a very beautiful kid. Take photos from your Samsung she started yelling. 😆",2,Shaikh7866,1733298305.0
1guqega,m0c68ck,While funtouch OS isn't something I have about it still is trh most stable OS ,1,FinePersimmon3718,1733298718.0
1guqega,m50a6x5,Lol update doesn't mean the phone would last,1,Dismal_Code_2470,1735825832.0
1guqega,m0cc445,Yes....You are absolutely correct.,1,DemandAccording524,1733302644.0
1guqega,m0c74kq,"I am not speaking about the stability. It is one of the best out their after ColorOS 15 in stability. And now, with parallel animations, it is really good. I am speaking about the way it looks. Apps, usage, settings panel, quick view, notification center, everything doesn't look luxury to me. Please use Origin OS from a chinese vivo phone once & you will see what I am speaking about.",1,Shaikh7866,1733299292.0
1guqega,m50iwja,"Neither does iPhone,iOS 18 is a mess",2,DanYeoman,1735829176.0
1guqega,m0cbf03,"Look origin OS i know about it and it will stay china exclusive for now.


But funtouch OS isn't that bad. And x200 pro is the best phone here.",1,FinePersimmon3718,1733302166.0
1guqega,m0cg4ko,I have X100 Pro at home with my sister & I use it regularly. Funtouch is not luxurious feeling Ui like OneUi or ColorOS,1,Shaikh7866,1733305422.0
1guqega,m0cvfh2,Yeah that's that but does that make it any less usable ,1,FinePersimmon3718,1733314622.0
1guqega,m0d828c,"No, it doesn't. It is completely usable & works awesome. But for many people, look matters otherwise people & big reviewers wouldn't have bashed Vivo for not releasing Origin OS globally. They crave for Origin for a reason. Otherwise, Funtouch can do everything that Origin can do. But Still.",1,Shaikh7866,1733320083.0
1hala6r,m19ivmx,"Im in the same boat.
Its very hard to find somewhat good case for the X8 pro.

Normally i always buy the OEM cases but they are just impossible to find.
Right now using a 9 euro case from amazon 😅",3,SpaceToy,1733782122.0
1hala6r,m1c5zb0,"I'm getting ""an original one from AliExpress"" as no OEM cases are sold in Poland so far.

https://preview.redd.it/na0zqqyquz5e1.jpeg?width=1263&format=pjpg&auto=webp&s=eb8398e4aee1874d1e44884499b4b43fe6d55c2e",5,lukeroux1,1733824613.0
1hala6r,m1c68nn,"I bought 2 from Amazon and they're all trash lol

Ordered a Nillkin from AliExpress, it's bulky but is a solid case at least...",3,Art__Vandelayy,1733824796.0
1hala6r,m1crw8d,"I've got two from AliExpress, they're great. Will post links/photos when home from work.",3,CoolbananasKD,1733836864.0
1hala6r,m19unqj,"I've got a case coming from oppo, thought it would be the best bet.",1,ElectronicDetail8236,1733786119.0
1hala6r,m1c63gv,"Yeah, like 6USD! 🤣",1,lukeroux1,1733824694.0
1hala6r,m1ca0bg,You can find cases available on taobao,1,chesterqw,1733827379.0
1hala6r,m2ewenr,"Brand; Youngkit doing a case for the x8 pro. Looks good, considering it. But am also considering buying the phone! It's not cheap though, 40 bucks ...",1,Professional-Big6187,1734393410.0
1hala6r,m2xscdi,Oppo started selling the blue color case in their shopping app in India. Bought the case from the app.,1,prudhivisekhar,1734669692.0
1hala6r,m5jqwhr,Emailed Speigen and they said they have 'no plans' to release a case for the x8 pro annoyingly. The case for the X5 pro was great. Kept the phone in perfect condition for three years until I traded it in last week for the x8 pro,1,maytricks95,1736097341.0
1hala6r,m5q8vks,"I bought the The OPPO Find X8 Pro Aramid Fibre Magnetic Case from the Oppo website. Was quite expensive, but it feels good and protects it enough",1,ItsTheGaijin,1736185345.0
1hala6r,m1bctzs,"You can find the original one, or a copy of it, on AliExpress.",4,Kessiah,1733806748.0
1hala6r,m19j17k,Also Oppo didn't release a case...,2,ottoettiditotanetti,1733782173.0
1hala6r,m1c60w4,So expensive!,2,ottoettiditotanetti,1733824644.0
1hala6r,m35ppp1,"I've just bought the nillkin and loved its protection, but it just made the phone too toasty. And it didn't play nice with the Oppo wireless charger. I've defaulted back to the Oppo official case",2,roomyverse,1734800265.0
1hala6r,ma9gaai,Do you have any photos/links by any chance? And how are they holding up?😃,1,massier91,1738357054.0
1hala6r,m19w7m6,From official site?,1,ottoettiditotanetti,1733786668.0
1hala6r,m221kz7,"Mine has just arrived. It's very slim, doesn't protect the edges (just the corners) and is a fingerprint magnet, but feels tough for all its slimness.

Reminds me of the Sony style case - minimal protection but very svelte - but not as grippy and lacking the kickstand.

Shopping around now for something cheaper but a bit more substantial.",1,roomyverse,1734203608.0
1hala6r,m1c67rw,"Ahahaha I found one ""official"" for 30€, don't know if it's original or not...",1,ottoettiditotanetti,1733824780.0
1hala6r,m1caykl,Is it a Chinese shop?,1,ottoettiditotanetti,1733827997.0
1hala6r,m2hb95e,Really expensive... I hope Spigen and Ringke will produce some cases soon!,1,ottoettiditotanetti,1734435763.0
1hala6r,m8di0vw,Hello how's the quality of the case?,1,balars,1737478264.0
1hala6r,m6xg3u7,I don't understand why this phone seems not recognized by producers,1,ottoettiditotanetti,1736780716.0
1hala6r,m82mass,"Mannnn I've used Spigen cases for years... Protected every single phone. this is such a shame, I think the x8 pro is going to be my new phone!",1,Professional-Big6187,1737330182.0
1hala6r,m6dsa19,Is the whole case magnetic? Or is the magnet just a ring like MagSafe?,1,Informal_Ad_4269,1736505408.0
1hala6r,m1btcii,"The original one is only black? I have the white version, don't know if I want to hide that ahahha",1,ottoettiditotanetti,1733815884.0
1hala6r,m1b7ae0,They did but I guess it's not out everywhere. They have those magsafe cases,3,ImprovementSome8368,1733804252.0
1hala6r,m1s1vj8,"it's around 6 euros, this is not that expensive for a case",3,tomatediabolik,1734048365.0
1hala6r,magfz7v,"I do, I'll post them for you tomorrow. They're both holding up well.",1,CoolbananasKD,1738450863.0
1hala6r,m19x26m,"yeah, oppo UK I got it from",1,ElectronicDetail8236,1733786967.0
1hala6r,m1c69gk,"The ""carbon"" one?",1,lukeroux1,1733824812.0
1hala6r,m1da2n3,"It is an online marketplace similar to Amazon or AliExpress

Using the mobile app should be easier + they have English translation available on the mobile app",1,chesterqw,1733843743.0
1hala6r,m3807rl,Spigen website is 30 something the OnePlus 13.. so would be similar if they did,1,Professional-Big6187,1734830787.0
1hala6r,m8dy86l,"It is good quality, but it doesn't save the case from drops. Aesthetically good, but no protection.",1,prudhivisekhar,1737482707.0
1hala6r,m1btqlh,"The original case supplied with the white model in China is transparent, which I don’t like at all. So I took a black original case for the white model, just to protect it when I go out. I agree that it’s a shame to hide this pearly white.",3,Kessiah,1733816140.0
1hala6r,m19xjvk,Not present in the Italian store,2,ottoettiditotanetti,1733787142.0
1hala6r,m1c6rdp,"https://preview.redd.it/dcmc6gmdwz5e1.jpeg?width=1080&format=pjpg&auto=webp&s=206d87394a6b12c1dd99c320e5af4cd2fd1837d4

This one",1,ottoettiditotanetti,1733825162.0
1hala6r,m8gyn8l,Ok then I will order nillkin case,1,balars,1737514323.0
1hala6r,m1bwawg,"That's the point... Anyway thanks! I'll check those on Ali, hoping the famous brands will release good ones",2,ottoettiditotanetti,1733817835.0
1hala6r,m1c7ns8,"Was thinking about getting this one, but that's too much for a case from Ali for me :)",2,lukeroux1,1733825785.0
1hala6r,m9pmqxf,riesci a condividere il Link?,1,Aresurplace,1738100598.0
1hala6r,m8h9840,I am also searching for a good case.,1,prudhivisekhar,1737517985.0
1gv8guy,ly1v6nb,I am NOT paying $1945 Australian Dollars for the Pro version. God knows how much the Ultra will be?? Insane financial abuse.,10,Lanky-Pianist4075,1732077500.0
1gv8guy,ly04g0h,"Damn! How much is their Ultra going to cost.

Disappointing",4,LiamB43,1732055007.0
1gv8guy,ly22cea,VAT is 20% plus here. No wonder. My X7 ultra costed 900€ without tax. I would say x8 ultra is going to be 1399€.,5,orpheo_1452,1732080859.0
1gv8guy,lyjtsl0,Oppo is too greedy. Almowt double the price of china version,3,ehhmman,1732349957.0
1gv8guy,ly06n44,You can import the real deal global version using Wonda Mobile for 833 pounds right now. I used them to get my x7 ultra and they were amazing,3,forever_lurking11,1732055703.0
1gv8guy,m0qknox,"https://preview.redd.it/avzmcixxk95e1.jpeg?width=3456&format=pjpg&auto=webp&s=af0ddc4dd7f9ba81dbe9114d0c9043097ac86f98

Got the beast today, apart from the Huawei watch gt5 and case everything is free pre-order gifts from Oppo which also includes a 2 year manufacturer's warranty. Totally loving the device and watch.",2,TheXclone,1733506541.0
1gv8guy,ly2yh88,"This is way too expensive. No regular user will buy this. For that price, you can get trusted devices from iPhone and Samsung, which are what most people prefer because they know how good they are. Sorry, but OPPO completely messed up with this.",4,Andysoreal1,1732100861.0
1gv8guy,ly369zw,Oh dear...,1,1600x900,1732105043.0
1gv8guy,lyvbvbe,Isn't it the same price of s24 plus at release? ,1,AliRabie,1732516799.0
1gv8guy,m06o7p0,It actually costs 1299.99 euros here lmao,1,Art__Vandelayy,1733225043.0
1gv8guy,m1oir1z,Bought Find X8 with trade in program (from Mi 12T Pro). 570 usd for me.,1,yreimm0308n90,1734005398.0
1gv8guy,ly48nqs,"Damn, way too much, rather get an iphone or a pixel",1,Horror-Wedding-2338,1732119010.0
1gv8guy,ly2qelr,I will go nowhere near their new handsets at that price,1,JBZ_Nova,1732095617.0
1gv8guy,ly4zv2z,"I don't recommend paying 300€ haha, after 1 year you get no updates and they will launch Oppo X10 Pro. 3 phone in the same year that so stupid. After my Oppo Reno 8 pro is gone I won't be ever using Oppo again.",0,Pither404,1732127345.0
1gv8guy,ly2je7b,Damn Australia always has some insane prices,3,Art__Vandelayy,1732090846.0
1gv8guy,ly084z2,"I don't think the Ultra will come to Europe. It would be a 1400/1500€ phone, I don't think it would sell well",7,Art__Vandelayy,1732056178.0
1gv8guy,ly2t0ep,No it isn't because it's not coming to Europe.,5,Homolander,1732097393.0
1gv8guy,m06oeak,"Well actually the Pro is selling at 1299.99 euros here 😂 I don't think the Ultra will come now, as it would cost well over 1500€...",1,Art__Vandelayy,1733225152.0
1gv8guy,ly0917x,"I also used them to get my x7 ultra! Absolutely no complaints about their service.

The only reason I'm looking to switch is because of the global rom (the larger battery is also nice). If it comes to my carrier (Vodafone), maybe I can buy it for around 1000 euros. Still a little more expensive than I expected...",3,Art__Vandelayy,1732056467.0
1gv8guy,lyinuts,How was your experience using X7 Ultra? Is the speaker good compared to your previous phone?,2,TrailOfEnvy,1732328791.0
1gv8guy,ly4a55i,"Those are inferior, but ok",2,Homolander,1732119475.0
1gv8guy,ly7qx39,it'll take me 1.2k euros after conversion in my country for x8 pro. Insane I rather go with a xiaomi that's comparable yet 2/3 of the price,1,YeetusYouGae,1732171014.0
1gv8guy,lzjyd1a,It has 5 years of software support.,1,sethelele,1732885502.0
1gv8guy,ly0a2fs,"When you can get a Pixel 9 Pro here for £899, I was expecting the Chinese brands to be competitive. Let's hope Vivo, OnePlus, Xiaomi can provide some better prices.",6,LiamB43,1732056803.0
1gv8guy,ly2z4x1,[deleted],3,,1732101252.0
1gv8guy,ly3d4es,Dang I thought it's was the generation where Oppo came back here.,1,orpheo_1452,1732108081.0
1gv8guy,m06zcu3,I saw that the x8 pro has smaller sensor size than x7 ultra . That's a no go for me! Better buy is the ultras for the price and the photo quality imho.,1,orpheo_1452,1733230769.0
1gv8guy,lynixwx,Yeah mate I came from a s22 ultra and it's a massive upgrade in every way possible 😁😁 seriously I can't get over how good it is. Won't be upgrading for a few years,1,forever_lurking11,1732403080.0
1gv8guy,ly4rhxu,"Indeed, but I get a much better deal, if I trade my pixel 7 in black friday I get the pixel 9 pro for about $450. Still I wanted to try oppo or vivo or honor but they are getting hella expensive",5,Horror-Wedding-2338,1732124821.0
1gv8guy,ly8gexe,"Wow, that price really hurts. I would've likely given into the hype and bought one if it was a few hundred quid cheaper.",1,JBZ_Nova,1732187318.0
1gv8guy,lzlcuij,"Yeah my OPPO Reno 8 pro too... Still no update and I just got a brick soft and camera problems after ""security"" update",1,Pither404,1732904365.0
1gv8guy,ly4n33u,No chance Xiaomi will be cheaper,2,TalentedAmateur,1732123484.0
1gv8guy,ly4heaa,OnePlus will be cheaper but non pro Find X8 might be still cheaper than OP13. Realme GT 7 Pro will be cheaper than both OP13 and Find X8.,1,iceleel,1732121731.0
1gv8guy,ly3o2re,Only x8 pro come to Europe,4,Mateo30w,1732112268.0
1gv8guy,ly3x9st,"Not sure if they confirmed the whole X8 lineup, I don't think the regular X8 is coming",6,Art__Vandelayy,1732115408.0
1gv8guy,lzbc027,They had a lawsuite with Nokia I believe.,1,Better_Watch8756,1732745755.0
1gv8guy,ly49vqb,"Unfortunately not... I mean, they are coming back - Find X8 and X8 Pro will be sold in Europe. The last Find X here was the Find X5 I believe.    
But the Ultra, most likely nah, unless the Find X8/X8 Pro sell REALLY well. 🤷",2,Homolander,1732119394.0
1gv8guy,ly8lvla,"i'm planning to get it straight from china, somehow oppo allows me to purchase directly from their online store from Mainland. or i'll ask my relatives to help me get it. this would save nearly 50%, insanity!",1,YeetusYouGae,1732190317.0
1gv8guy,lzp6wcv,"i have a x5Pro, i have update nearly every month since his launch",1,the-capricorne,1732965991.0
1gv8guy,ly8ofp1,That would be the chinese version though wouldn't it? Not the global?,1,JBZ_Nova,1732191565.0
1gv8guy,ly8qpsx,"yeah paying $600 more for the global is too much, i grew up speaking chinese so i sort know to read reconfigure their setting",1,YeetusYouGae,1732192618.0
1gv8guy,ly8smii,"That sounds like a good idea then. I would want the pro over the base model, however the overall price is not something I want to pay when my current phone is still in it's contract.",1,JBZ_Nova,1732193459.0
1gv8guy,ly9qfoc,"yeap, it's really not worth it, prices may only fall to mainland levels a year or so later, hopefully your contract is up then or so",1,YeetusYouGae,1732208192.0
1gv8guy,ly9z1fk,"600 USD difference is almost a whole new phone lol this global tax sucks. 

There are still no official prices here in Portugal, but unless I can buy it under 1000 I'm not getting it. 1199€ no chance man",1,Art__Vandelayy,1732210756.0
1gv8guy,lyd32st,"if you want to visit taobao and find their official store, use a shipping forwarder to deliver it if you are fine using non-global",1,YeetusYouGae,1732248111.0
1if1coz,macdv7i,"First of all, mediatek 9400 isn't shit at all, it competes closely with 8 elite in every category lol. And second if all that is the 5270mah version and it does barely worse than a 5910mah oppo.",9,BackinAbyss,1738396116.0
1if1coz,mace6e3,"I don't have 7P, but I clearly feel that the battery issues are caused by software problems. When I first bought 6P, the battery lasted incredibly long, but after just a few days, it became terrible. The same thing probably happens with the 7P too.",3,timistudios,1738396296.0
1if1coz,mace7hn,"Lowest mine ever goes is nearly 50% after a full day normal use. The biggest amount of hammer it took was when I went out hiking and used the camera all day.

 That took it down to around 30-40% after a long road trip with varying signal strength, then 5 hours of taking photos and videos. 

While the comparison may show it as an underperformer, it's actually a pretty efficient device.",3,Johns252,1738396315.0
1if1coz,madwbhd,global version is fine..,2,Think-Catch-1737,1738422810.0
1if1coz,maenbdw,Just a quick note.. the Dimensity 9400 definitely is not shit ffs,4,Mark_JCW,1738431054.0
